body,title
"La semblanza del Manchester City es la de un club con 140 años de vida y dos etapas claramente diferenciadas en su existencia, tanto en el aspecto futbolístico como en el económico. Muy poco tiene en común, ni siquiera los colores, el escudo y el estadio, el todopoderoso club que es desde 2008, bajo la propiedad de capital emiratí, con el que se fundó en 1880 como St. Mark’s; en 1887 pasó a ser Ardwick y en 1894 ya adoptó su nominación actual para padecer una subsistencia turbulenta entre descensos de categoría, quiebras, compras y ventas.Sobre el nuevo City que en 12 años ha amasado 14 títulos, cuatro Premier incluidas, y busca la ratificación internacional de la Champions, se sabe prácticamente todo desde que fichara a Robinho como primera piedra de su gran proyecto. El otro City encierra muchas más sombras que luces. Una de las más alargadas y que más ha tenido que sufrir es la del otro gran club de la capital, el United. Los de Old Trafford históricamente siempre han sido el símbolo de la ciudad del noroeste de Inglaterra con su solvencia financiera y su palmarés deportivo.Repasar la vida del City -ha sobrevivido a caballo entre tres siglos- es encontrar un trienio de gloria (1967-70) y muchas décadas de penas salpicadas con algún título esporádico. Entró a formar parte de la Football League en 1899 y obtuvo relativamente pronto su primer título, la FA Cup en 1904. Solo dos Ligas, con 30 años de distancia en el tiempo, alumbran su palmarés hasta la llegada de los Emiratos: 36-37 y 67-68.Llamó la atención en Inglaterra que los citizen conquistaran ese título. Dos años antes estaban en Segunda. Además, destronó a su gran rival, al United, que fue segundo a dos puntos y 18 días después se proclamaría campeón de Europa. Hasta ese punto alcanza su maldición con su eterno enemigo. El City se clasifica por primera vez para disputar la Copa de Europa. Su debut es a su vez la despedida. Es eliminado por el Fenerbahçe en la primera eliminatoria.Sin embargo, la conquista de la FA Cup, cuarta en su historia, con un gol de una de sus estrellas, Young, al Leicester, le permite volver a las competiciones europeas. A la Recopa 69-70. Esta vez con mejor suerte. Se proclama campeón tras derrotar al Gornik, polaco, en el Prater de Viena (2-1). Tantos de Young y Lee. Por el camino elimina al Athletic en la primera ronda. Es su único título europeo. También gana la Copa de la Liga.En ese trienio mágico forman tándem en el banquillo Joe Mercer y Malcom Allison y sus jugadores más representativos eran el centrocampista ofensivo Francis Lee; el interior todoterreno Colin Bell, ambos van con Inglaterra al Mundial de México 70; un extremo de los de toda la vida, Mike Summerbee, y el delantero centro Neil James Young.Aunque solo jugara en el City dos temporadas separadas 13 años en el tiempo, Denis Law –Balón de Oro en 1964- también se ganó el reconocimiento de la afición celeste. Tras ganar con el United la Copa de Europa en 1968, decide regresar a Maine Road, donde había jugado una temporada (60-61) antes de ser traspasado al Torino.Su vuelta está marcada por un gol de tacón en la última jornada del curso 73-74, que manda a Segunda al equipo donde había jugado 11 años hasta convertirse en una de sus leyendas. Fue su último partido profesional. No celebró el tanto y atravesó con la mirada perdida en el suelo la distancia entre el área y el círculo central. Siempre confesó que había marcado sin querer. “Fue un gesto instintivo. Me sentía como un niño que había matado a una paloma”.Desde esos momentos álgidos, la existencia del City transcurre entre sustos y lamentos. Desde la Copa de la Liga de 1976 pasan 35 años hasta que gana un título, la FA Cup 2011, ya bajo el manto de los Emiratos. En la década de los 80 desciende dos veces a Segunda. En 1992 es uno de los fundadores de la Premier. Vuelve a bajar en el 96 y toca fondo en el 98 con su descenso a Tercera. Recupera su posición en la élite con dos ascensos consecutivos, lo que no le impide volver a Segunda en 2001.Desde el 2002, año en el que abandona su mítico estadio de Maine Road, se ha mantenido en la Premier y por su banquillo han pasado técnicos de considerable prestigio hasta llegar a Guardiola: Keegan, Pearce, Eriksson, Hughes, Mancini, Kidd y Pellegrini. Ocho entrenadores en lo que va de siglo.Inmediatamente antes de la llegada de Mansour Bin-Zayed en septiembre de 2008 tras desembolsar 250 millones de euros, el club pasó por una última crisis propiciada por su penúltimo propietario. Thaksin Shinawatra, exprimer minutos tailandés, compró en junio de 2007 el 75% de las acciones pero tuvo que venderlo un año después porque la justicia de su país había congelado todos sus activos económicos.Más títulos desde 2008 que en toda su historia Desde que los Emiratos son los dueños ha sumado 14 títulos, por tan solo 12 desde su creación en 1880.- Siglo XIX y XX: 2 Ligas, 4 Copas, 1 Recopa, 2 Copas de la Liga y 3 Charitys.- Siglo XXI (desde 2008): 4 Premier, 2 Copas, 5 Copas de la Liga, 3 Charitys.",El otro City 
"El presidente del Gobierno, Pedro Sánchez, ha aprovechado el último Consejo de Ministros antes de las vacaciones de verano para esbozar un plan que impulsará la recuperación económica que se iniciará ya este año, se acelerará durante 2021 y 2022, y se completará en 2023, superando incluso los niveles de antes de la pandemia de la covid-19, según las previsiones que maneja el Ejecutivo. La esperada reforma fiscal tendrá que esperar a esa recuperación del PIB.Entre las medidas anunciadas por Sánchez, algunas de las cuales ya habían sido notificadas en anteriores reuniones del gabinete, se encuentran un impulso a la inversión en la red de Cercanías, la reorientación del Plan de Vivienda hacia alquileres ""asequibles"", la aprobación del estatuto del consumidor electrointensivo, un nuevo plan para la internacionalización de la economía y la revisión de la fiscalidad de la alimentación, entre otras.El jefe del Ejecutivo admitió que todavía quedan “meses muy difíciles” en el terreno económico, pero se mostró convencido de que la recuperación comenzará este año y el crecimiento del PIB se incrementará en 2021 para despegar con mayor velocidad en 2022 gracias a los fondos de reconstrucción que provendrán de la Unión Europea.Para 2023, augura que el PIB puede rebasar incluso el de 2019 pero con un crecimiento “mejor, más competitivo y más productivo”, y un “salto en digitalización, sostenibilidad, cohesión social y territorial y competitividad”, que “no dejará a nadie por el camino”.Sánchez ha detallado que la agenda de Gobierno que se pondrá en marcha en los próximos meses pasa por una “atención preferencial” a las medidas contempladas en el acuerdo de coalición con Unidas-Podemos, unas medidas que buscan la creación de empleo de calidad, para lo que se renovarán las políticas activas de empleo, se consolidarán los expedientes de regulación temporal de empleo (ERTE) como alternativa al despido. Sobre la polémica derogación de los aspectos más lesivos de la reforma laboral, el jefe del Ejecutivo se limitó a señalar que se realizará dentro del diálogo social como garantía “necesaria e imprescindible” de la estabilidad que precisa España.El presidente se refirió al préstamo de 20.000 millones que España ha solicitado formalmente a la Comisión Europea los fondos del SURE para costear los ERTE y restó importancia a las críticas que los señalan como fondos de rescate. “Hay gente que cree que con esto se puede entrar en si a España se la ha rescatado o no. Pero es un juego que a mi me importa más bien poco. Vamos a acogernos al fondo de reaseguro de desempleo porque queremos proteger a los trabajadores de los ERTE. La oposición dirá que es un rescate. Efectivamente, es un rescate a los trabajadores que necesitan del apoyo de lo público”, recalcó.Reforma fiscalEn materia fiscal, el presidente Sánchez reiteró la intención del Ejecutivo de emprender una reforma “estructural”, aunque la supeditó a “una vez que el PIB haya recuperado los niveles previos a la pandemia de coronavirus”, una recuperación que, según sus pronósticos, solo se completará en 2023.“No podemos salir con un Estado del bienestar más endeble”, advirtió porque España necesita una recaudación “más estable” a lo largo del ciclo económico, especialmente en un momento en que se va a incurrir en un déficit y una deuda pública “enorme”. También descartó que, por ahora, se vaya a acudir a los préstamos del Mecanismo Europeo de Estabilidad (MEDE) para financiar el gesto sanitario.Ferrocarril y AlquileresRespecto a la inversión pública, el plan de infraestructuras se centrará en mejorar la red de Cercanías y cerrar corredores ferroviarios en construcción como el Corredor Mediterráneo o el Atlántico, aunque no citó expresamente los propósitos sobre la extensión de la red del AVE, cuyo gasto fue recientemente criticado por la autoridad fiscal independiente (Airef).En la misma línea, ratificó la ya anunciada reestructuración del actual Plan Estatal de Vivienda 2018-2021 para derivarlo a la construcción de pisos para alquiler “asequibles” y el impulso de la rehabilitación. El Ministerio de Transporte ya anunció un plan que prevé la rehabilitación de viviendas a dos años que supondrá movilizar una inversión, pública y privada, de unos 2.000 millones de euros. Este plan aspira a multiplicar por cuatro el número de pisos que se reforman al año en España, de forma que ascienda a unos 120.000 anuales, con la generación de 221.000 empleos.También ha adelantado que se acometerán acciones concretas que contribuyan al crecimiento, con una actividad ya avanzada en el programa del Gobierno, como la aprobación del estatuto del consumidor electrointensivo para evitar la fuga de las industrias de alto consumo eléctrico. También se abordará el tercer plan para la internacionalización de la economía 2021-2022 y una carta de derechos digitales ante las grandes corporaciones.En el ámbito del empleo público, ha avanzado que se aprobará el proyecto de Ley de Función Pública en la Administración General del Estado (AGE) y se desarrollará el Estatuto Básico del Empleado Público, al tiempo que se elaborará un pacto de estado para la modernización de la administración de la Justicia.Igualmente, ha apuntado que se aprobará un Plan estatal de I+D+i, la estrategia española de ciencia, tecnología e innovación 2021-2027 y medidas en el ámbito de la igualdad. A su vez, se impulsarán acciones en defensa de los consumidores, como la aprobación de un real decreto sobre el juego y una revisión de la fiscalidad sobre los alimentos, así como la introducción de la figura del consumidor vulnerable.Información sobre el coronavirus- Aquí puede seguir la última hora sobre la evolución de la pandemia- El mapa del coronavirus: así crecen los casos día a día y país por país- Preguntas y respuestas sobre el coronavirus- Guía de actuación ante la enfermedad- En caso de tener síntomas, estos son los teléfonos que se han habilitado en cada comunidad- Pincha aquí para suscribirte a la newsletter diaria sobre la pandemia",Sánchez anuncia un plan de choque para garantizar la recuperación económica total en 2023  
"Tras seis días ardiendo, el incendio de Cualedro (Ourense) ha sido extinguido este martes. Se trata del mayor fuego registrado en Galicia desde 2017, cuando se produjo una insólita ola incendiaria en pleno otoño. Las llamas han calcinado, según los datos de la Xunta, 1.535 hectáreas de superficie en Cualedro. Comenzaron el pasado miércoles y no fueron controladas hasta el sábado.Del terreno arrasado por el fuego de Cualedro 525 hectáreas son agrícolas y 1.010 forestales (unas 960 rasas y unas 50 arboladas). Para lograr apagar este incendio fue movilizada la Unidad Militar de Emergencias (UME), que trabajó codo a codo con un equipo de extinción formado por dos técnicos, 54 agentes, 132 brigadas, 51 motobombas, seis palas, 13 helicópteros y 13 aviones.El Gobierno gallego sostiene que este incendio ha sido intencionado porque empezó el miércoles al mediodía en la parroquia de San Millao “en al menos dos puntos diferentes simultáneos”. Su evolución llegó a obligar a activar el nivel de alerta 2 por su cercanía a viviendas.Mientras se extinguen las llamas en Cualedro, el fuego sigue golpeando la provincia de Ourense. Un incendio forestal afecta este martes al municipio de Viana do Bolo y, según informa la Xunta, ha afectado ya a unas 40 hectáreas.",Extinguido el mayor incendio en Galicia desde 2017 tras arder durante seis días
"Cuando en la segunda mitad del siglo pasado los científicos comenzaron a profundizar en la naturaleza del cáncer, descubrieron que era algo inherente a la naturaleza humana. Una acumulación de fallos en los procesos normales que nos permiten vivir podían generar una proliferación de células descontrolada que nos acabase matando. El estudio de fósiles antiguos ha mostrado que estas enfermedades han hecho sufrir a todo tipo de seres vivos desde hace millones de años.Esta semana, un equipo del Museo Real de Ontario (MRO) y la Universidad McMaster, en Canadá, publican el primer diagnóstico de un tumor maligno en un dinosaurio. El trabajo, recogido en la revista médica The Lancet Oncology, describe cómo los paleontólogos y patólogos identificaron un osteosarcoma, un tipo de cáncer agresivo que afecta a los huesos, en los restos de un Centrosaurus apertus, un dinosaurio con cuernos parecido al mítico triceratops, que murió hace unos 76 millones de años.Los restos se habían encontrado en un yacimiento en la región canadiense de Alberta en 1989. Entonces se pensó que el extremo anómalo del peroné había sido causado por una fractura. En 2017, en una visita al Museo Real Tyrrell, varios miembros del grupo del MRO y la Universidad McMaster observaron características peculiares en el hueso de aquel dinosaurio cornudo y pidieron permiso para analizarlo con la tecnología médica más avanzada.Utilizando técnicas de diagnóstico por imagen tridimensional y análisis microscópico del hueso a nivel celular concluyeron que el animal sufría un tumor muy avanzado que, probablemente, habría invadido otras partes de su cuerpo. “El cáncer habría tenido efectos discapacitantes en aquel individuo y lo haría muy vulnerable a depredadores de aquel tiempo como los tiranosaurios”, ha explicado en un comunicado de su institución David Evans, investigador del MRO y coautor del estudio. Sin embargo, por el lugar en el que se encontraron los huesos, parece que el Centrosaurus enfermo no pereció por su enfermedad y lo hizo junto a gran parte de su manada cuando fueron sorprendidos por una inundación. Ese rebaño, en el que convivía junto a otros herbívoros como él, le protegió y le permitió sobrevivir durante más tiempo del que se esperaría para un dinosaurio con una dolencia tan grave.Aunque el caso de cáncer presentado ahora sea el más antiguo en un dinosaurio, se ha identificado algún tumor aún más antiguo. En 2019, en Jama Oncology, se publicó el hallazgo de otro cáncer de hueso en una tortuga que murió hace unos 240 millones de años. En humanos también se han detectado osteosarcomas. En unos restos descubiertos en la cueva de Swartkans, en Sudáfrica, se diagnosticó esta enfermedad en un hueso del dedo de un individuo que vivió hace 1,7 millones de años y en el esqueleto de un Australopithecus sediba de hace dos millones de años hallado en Malapa, también en Sudáfrica, se detectó un tumor en una vértebra del tórax.Este tipo de estudios muestran que, pese a que algunos hábitos asociados a la vida moderna, como fumar, tomar alcohol o comer en exceso, incrementan el riesgo de padecer cáncer, la enfermedad ha sido parte de la vida de los humanos y de muchos otros animales desde hace millones de años. Estudios como el que se ha publicado esta semana en The Lancet Oncology son útiles para comprender la evolución de enfermedades tan prevalentes como los tumores.Puedes escribirnos a daniel@esmateria.com o seguir a MATERIA en Facebook, Twitter, Instagram o suscribirte aquí a nuestra Newsletter.",Diagnosticado un tumor maligno en un dinosaurio que murió hace 76 millones de años
"Pilló “el bicharraco” en marzo y se encerró en Zeberio (Bizkaia), el pueblo de un millar de habitantes donde vive desde hace más de 25 años —él tiene 58—. Ha estado varias veces nominado al premio a mejor orador del Congreso, pero el oscar se lo llevó una vez. En el hemiciclo se considera “un dinosaurio”, porque acumula más legislaturas que la mayoría —”Albert Rivera se iba a comer el mundo y míralo. La todopoderosa Soraya Sáenz de Santamaría, excelente parlamentaria, tampoco está”—.Aitor Esteban (PNV): “La sociedad española no está preparada para un referéndum de autodeterminación”La epidemia enfria la relación entre PNV y PSOE125 años del PNV, el partido que se hizo paisajeP. ¿Cree que funcionarán los cortafuegos con Felipe VI?R. Creo que no. Lo tendrá que valorar la sociedad. Podrán retrasarlo lo que quieran, pero si no hay cambios, no tiene mucho futuro y me temo que llega tarde. El mito de Juan Carlos I que nos salvó a todos, ahora queremos convertirlo en el mito de Felipe inmaculado. No caigamos en el mismo error. En pleno siglo XXI no es entendible una Monarquía tal y como se interpreta ahora. Entiendo que haya muchos españoles monárquicos, pero no que defiendan que la Monarquía pueda ser oscura, inviolable o que pueda aprovecharse de su posición institucional para hacer fortuna. El sentido de inviolabilidad tiene que cambiar. Y la institución tiene que volverse austera y controlada. Si no, creo que está abocada a la desaparición.P. ¿Qué es lo peor que ha oído en el Congreso?R. La descalificación personal. Es inaceptable y ahora es reiterada. Creen que pueden decir lo que sea y que al salir de clase somos amiguitos, pero si te pasas de la raya, deja marca. Falta profesionalidad en la política.P. ¿Y por qué cree que es?R. Creo que ha sido por imitación. Irrumpe gente que cree que se va a comer el mundo a bocados por chillar. Da la sensación de que esa agresividad es lo moderno, pero la política son acuerdos.P. ¿Se ha enfriado la relación con Pedro Sánchez?R. Sí. Llegamos a un acuerdo de investidura como “socio prioritario”, pero se nos está agotando la confianza. No entendemos la negativa a cumplir lo que firmamos sobre el concierto, que para nosotros es como el comer. El Gobierno picotea aquí y allá, nos avisa a última hora de lo que va a hacer y transmite la sensación de marejada constante. Me fío lo justo.P. ¿Cree que el pacto del Gobierno con Bildu para derogar la reforma laboral fue una aventura pasajera?R. No sé. Tienen toda la legitimidad para llegar a acuerdos con quien quieran, pero deberían avisar. Y, ¿qué rayos de acuerdo fue ese? Luego lo desmintieron y lo firmaban grupos parlamentarios sin mayoría para derogar la reforma laboral. Creemos que hay que tocar esa legislación, pero pretender derribarla como un castillo y crear un vacío no tiene sentido.P. Han pactado con promiscuidad, a derecha e izquierda, y tienen fama de negociadores duros. ¿El PNV siempre gana, como la banca?R. O cuando perdemos no lo decimos. Somos un partido muy diverso. Nunca diremos cosas del tipo “con esos rojos peligrosos nada de nada” o “jamás pactaremos con el PP”. Sí hay una línea roja con el fascismo, pero mientras sean partidos democráticos, tienes que intentar influir para que los demás no hagan algo que perjudique a tu electorado o a tu programa. Nos votan para eso, no para que vayamos a la tribuna a pegarnos berridos.P. ¿Cree que Mariano Rajoy le habrá perdonado ya por apoyar la moción de censura después de pactar el voto a favor de sus presupuestos?R. ¿Qué me tiene que perdonar? Yo también podría pensar si voy a perdonar a Rajoy porque él sabía que iba a salir la sentencia de Gürtel e igual, si lo llegamos a saber, nosotros no habríamos votado lo que votamos. El primero que le dijo te vas a hundir fue Rivera y el PNV no le daba la mayoría para mantener la legislatura. ¿Deberíamos haberle salvado para morir en la orilla a los tres meses con otra moción?P. Pregunta del CIS: del 0 al 10, siendo 0 la extrema izquierda y 10 la extrema derecha, sitúe: PP, Vox, Cs, PSOE, Podemos, ERC, Junts y el PNV.R. El PP es un 8. Vox, un 10, y por nombres y apellidos, alguno un 11. Ciudadanos, un 7. El PSOE (pausa), un 4,5. Podemos, depende. El que está ahora en el Gobierno dice a todo tolón tolón. Ponle un 2,5. ERC, 2,5 también. Junts, un 6 o 6,5. Y el PNV, un 5.P. ¿El PNV es el único centro?R. Sí, es lo que nos da fuerza. Por nombres y apellidos alguno está en el 4 y otro en el 6, incluso el 7. Los órganos que lo dirigen suelen estar en un 5. Para políticas sociales tiramos más al 4,5 y para política industrial un 5,5 o 6. Navegamos según el tema.P. ¿Cree que verán sus ojos un gobierno del PP y Vox, que pide su ilegalización?R. He visto tantas cosas aquí que ya no me atrevo a decir esto no pasará. Sería terrible. A este PP lo veo mucho más cercano a Vox.P. ¿Le da envidia la mesa de diálogo con Cataluña?R. Ninguna. No necesitamos un instrumento más. Ellos sabrán.P. ¿Es independentista?R. Sí, pero antes de nada soy demócrata, y sé que las cosas no se resuelven en un tris-tras. Me gustaría que Euskadi tuviera representación directa como otro país europeo. Tendremos que ir buscando nuestro hueco, desde la convicción amplísimamente mayoritaria de nuestro pueblo y mediante mecanismos democráticos.","Aitor Esteban: “Si no cambia,  la Monarquía  desaparecerá”"
