body,title,url
"La semblanza del Manchester City es la de un club con 140 aos de vida y dos etapas claramente diferenciadas en su existencia, tanto en el aspecto futbolstico como en el econmico. Muy poco tiene en comn, ni siquiera los colores, el escudo y el estadio, el todopoderoso club que es desde 2008, bajo la propiedad de capital emirat, con el que se fund en 1880 como St. Marks; en 1887 pas a ser Ardwick y en 1894 ya adopt su nominacin actual para padecer una subsistencia turbulenta entre descensos de categora, quiebras, compras y ventas.Sobre el nuevo City que en 12 aos ha amasado 14 ttulos, cuatro Premier incluidas, y busca la ratificacin internacional de la Champions, se sabe prcticamente todo desde que fichara a Robinho como primera piedra de su gran proyecto. El otro City encierra muchas ms sombras que luces. Una de las ms alargadas y que ms ha tenido que sufrir es la del otro gran club de la capital, el United. Los de Old Trafford histricamente siempre han sido el smbolo de la ciudad del noroeste de Inglaterra con su solvencia financiera y su palmars deportivo.Repasar la vida del City -ha sobrevivido a caballo entre tres siglos- es encontrar un trienio de gloria (1967-70) y muchas dcadas de penas salpicadas con algn ttulo espordico. Entr a formar parte de la Football League en 1899 y obtuvo relativamente pronto su primer ttulo, la FA Cup en 1904. Solo dos Ligas, con 30 aos de distancia en el tiempo, alumbran su palmars hasta la llegada de los Emiratos: 36-37 y 67-68.Llam la atencin en Inglaterra que los citizen conquistaran ese ttulo. Dos aos antes estaban en Segunda. Adems, destron a su gran rival, al United, que fue segundo a dos puntos y 18 das despus se proclamara campen de Europa. Hasta ese punto alcanza su maldicin con su eterno enemigo. El City se clasifica por primera vez para disputar la Copa de Europa. Su debut es a su vez la despedida. Es eliminado por el Fenerbahe en la primera eliminatoria.Sin embargo, la conquista de la FA Cup, cuarta en su historia, con un gol de una de sus estrellas, Young, al Leicester, le permite volver a las competiciones europeas. A la Recopa 69-70. Esta vez con mejor suerte. Se proclama campen tras derrotar al Gornik, polaco, en el Prater de Viena (2-1). Tantos de Young y Lee. Por el camino elimina al Athletic en la primera ronda. Es su nico ttulo europeo. Tambin gana la Copa de la Liga.En ese trienio mgico forman tndem en el banquillo Joe Mercer y Malcom Allison y sus jugadores ms representativos eran el centrocampista ofensivo Francis Lee; el interior todoterreno Colin Bell, ambos van con Inglaterra al Mundial de Mxico 70; un extremo de los de toda la vida, Mike Summerbee, y el delantero centro Neil James Young.Aunque solo jugara en el City dos temporadas separadas 13 aos en el tiempo, Denis Law Baln de Oro en 1964- tambin se gan el reconocimiento de la aficin celeste. Tras ganar con el United la Copa de Europa en 1968, decide regresar a Maine Road, donde haba jugado una temporada (60-61) antes de ser traspasado al Torino.Su vuelta est marcada por un gol de tacn en la ltima jornada del curso 73-74, que manda a Segunda al equipo donde haba jugado 11 aos hasta convertirse en una de sus leyendas. Fue su ltimo partido profesional. No celebr el tanto y atraves con la mirada perdida en el suelo la distancia entre el rea y el crculo central. Siempre confes que haba marcado sin querer. Fue un gesto instintivo. Me senta como un nio que haba matado a una paloma.Desde esos momentos lgidos, la existencia del City transcurre entre sustos y lamentos. Desde la Copa de la Liga de 1976 pasan 35 aos hasta que gana un ttulo, la FA Cup 2011, ya bajo el manto de los Emiratos. En la dcada de los 80 desciende dos veces a Segunda. En 1992 es uno de los fundadores de la Premier. Vuelve a bajar en el 96 y toca fondo en el 98 con su descenso a Tercera. Recupera su posicin en la lite con dos ascensos consecutivos, lo que no le impide volver a Segunda en 2001.Desde el 2002, ao en el que abandona su mtico estadio de Maine Road, se ha mantenido en la Premier y por su banquillo han pasado tcnicos de considerable prestigio hasta llegar a Guardiola: Keegan, Pearce, Eriksson, Hughes, Mancini, Kidd y Pellegrini. Ocho entrenadores en lo que va de siglo.Inmediatamente antes de la llegada de Mansour Bin-Zayed en septiembre de 2008 tras desembolsar 250 millones de euros, el club pas por una ltima crisis propiciada por su penltimo propietario. Thaksin Shinawatra, exprimer minutos tailands, compr en junio de 2007 el 75% de las acciones pero tuvo que venderlo un ao despus porque la justicia de su pas haba congelado todos sus activos econmicos.Ms ttulos desde 2008 que en toda su historia Desde que los Emiratos son los dueos ha sumado 14 ttulos, por tan solo 12 desde su creacin en 1880.- Siglo XIX y XX: 2 Ligas, 4 Copas, 1 Recopa, 2 Copas de la Liga y 3 Charitys.- Siglo XXI (desde 2008): 4 Premier, 2 Copas, 5 Copas de la Liga, 3 Charitys.",El otro City ,https://elpais.com/deportes/2020-08-04/el-otro-city.html

"Nadal, durante su participacin en 2019 en el US Open.DON EMMERT / AFPDa tras da, el mundo del tenis ve cmo la situacin del circuito se resquebraja un poco ms. Tras conocerse de manera oficial que los organizadores del Mutua Madrid Open han cancelado definitivamente la celebracin del torneo en 2020, este martes fue Rafael Nadal el gran protagonista al anunciar su renuncia a participar y defender su corona en el US Open, previsto entre el 31 de agosto y el 13 de septiembre, debido a la inestable situacin sanitaria causada por la pandemia de la covid-19. Tampoco estar en el torneo previo de Cincinnati que se disputa tambin en la burbuja de Nueva York a partir del 20 de agosto.MS INFORMACINRafa Nadal: Esta crisis nos ha sobrepasado a todos, pero somos un gran pasTras pensarlo mucho he decidido no participar en el US Open de este ao. La situacin sanitaria sigue muy complicada en todo el mundo con casos de covid-19 y rebrotes que parecen fuera de control. Sabemos que el calendario de este ao tras cuatro meses sin jugar es una barbaridad, si bien entiendo y agradezco los esfuerzos que todas las partes estn poniendo para que se jueguen torneos, dijo el vigente nmero dos del mundo en un comunicado.Acabamos de tener la noticia de que el torneo de Madrid tambin ha sido anulado. A da de hoy la situacin es complicada para hacer torneos y todo mi respeto a la USTA, organizadores del US Open y a la ATP por los esfuerzos que estn haciendo para que se juegue el torneo para los millones de fans que lo vern por televisin o en las plataformas digitales. Esta es una decisin que no querra tomar, pero en este caso sigo mi corazn para decidir que por ahora prefiero no viajar, concluy el tenista balear.A primeros de mayo, en una entrevista concedida a EL PAS, Nadal se mostr pesimista con las opciones de retomar la competicin en 2020. Ojal, pero no lo creo. Desgraciadamente... Yo firmo estar listos para 2021. Ojal. Me preocupa ms el Open de Australia que lo que ocurra a finales de este ao. El 2020 lo veo prcticamente perdido. Tengo la esperanza de poder empezar el prximo ao. Ojal que as sea. Un mes despus, con el anuncio de las fechas dispuestas para el US Open, el manacorense ya se mostr reacio a viajar a EE UU: Si no hay una total seguridad no tiene sentido jugar porque tenemos que ser responsables y dar ejemplo. Ahora mismo no me gustara ir a jugar un torneo de tenis a Nueva York. Pero no lo s dentro de dos meses porque no sabemos si la situacin va a mejorar, dijo entonces dejando entreabierta una puerta que este martes termin de cerrar.Pese a que se haba apuntado en la prelista del torneo, el nmero dos del mundo finalmente opt por primar la seguridad, no desplazarse a Estados Unidos, y de esta forma preparar con todas las garantas la gira de tierra batida. Con esta decisin, Nadal sigue el camino que abrieron hace pocos das los australianos Nick Kyrgios, que pidi responsabilidad al resto de jugadores, y Ashleigh Barty, nmero uno del circuito femenino, y a los que ya se haban sumado Fabio Fognini, Stan Wawrinka, Gael Monfils y Jo Wilfred Tsonga, que tampoco estarn en la llamada burbuja de Nueva York, similar a la que ha creado la NBA en las instalaciones de Disney World, en Orlando. Tampoco estar Roger Federer, aunque en este caso por una lesin que le mantendr alejado de las canchas hasta 2021.Unas bajas que no han frenado a la USTA, organizadora del US Open, que sigue adelante con el torneo en su intento por ser el primer Grand Slam del ao. De hecho, casi a la vez que Nadal haca pblica su decisin, el grande neoyorquino revel la lista definitiva de participantes, entre los que s estarn Novak Djokovic, nmero uno del mundo; Daniil Medvedev, finalista el pasado ao; Stefanos Tsitsipas; Dominic Thiem o Alexander Zverev, pese a que el alemn haba reconocido recientemente que era un poco locura jugar el torneo. No estar Federer, aunque en su caso por lesin.A lo que no renuncia el balear es a la gira de tierra batida, que ya ha empezado a preparar. Tras la cancelacin del Mutua Madrid Open, el tenis en polvo de ladrillo ha quedado reducido a solo dos torneos, el Masters 1000 de Roma, del 20 al 27 de septiembre y donde reaparecera Nadal, y Roland Garros, que por ahora est programado del 27 de septiembre al 11 de octubre y en el que tambin defiende corona. Ah, en Pars, en una Philippe Chatrier remodelada que estrena techo retrctil y en la que ha reinado en 12 ocasiones, intentar asaltar el trono de Federer como tenista con ms Grand Slams de la historia, 20.A dia de hoy la situacin es complicada para hacer torneos y todo mi respeto a la USTA, organizadores del US Open y a la ATP por los esfuerzos que estn haciendo para que se juegue el torneo para los millones de fans que lo vern por TV o en las plataformas digitales.� Rafa Nadal (@RafaelNadal) August 4, 2020

",Nadal renuncia a disputar el US Open por la pandemia,https://elpais.com/deportes/2020-08-04/nadal-renuncia-a-disputar-el-us-open.html

"Vuelta de tuerca a la estrategia de Catalua para contener el coronavirus. Tras la deteccin de un nuevo foco en la comarca barcelonesa del Valls, donde la incidencia se ha duplicado en la ltima semana, la comunidad ha optado por salir a buscar activamente el virus: el Departamento de Salud desplegar un cribado masivo de la covid-19 entre unas 9.000 personas de tres municipios de la zona para atajar la transmisin. Este muestreo poblacional al estilo asitico se realizar en varios vecindarios de Terrassa, Sabadell y Ripollet donde hay ms presencia de la covid-19. Sera el primero de este tipo en Espaa.El Govern contabiliza ms de 100.000 casos de covid-19 y pone el foco en el VallsTrece comarcas catalanas estn en riesgo alto de rebroteNo pongas en peligro ni tu vida, ni la de tus vecinos Salud instalar carpas para realizar pruebas PCR a 4.000 vecinos de Sabadell (aunque el Ayuntamiento ha dicho que sern 3.000) y otros 3.000 de Terrassa durante tres das a partir del jueves. En Ripollet, donde la zona afectada est ms acotada, Salud Pblica tambin ir puerta a puerta de viviendas y comercios para realizar otras 2.000 PRC desde este mircoles. Queremos adelantarnos a que haya transmisin comunitaria, ha dicho este martes el secretario de Salud Pblica, Josep Maria Argimon.No es la primera vez que se instalan carpas en un municipio para hacer PCR masivas. En la localidad vasca de Ordizia se hizo un llamamiento a los vecinos que haban estado de copas por unos locales de la calle Etxezarreta. En Crdoba, se test a ms de un millar de personas (la mayora en un espacio autocovid, donde la prueba se realiza en coche sin salir del vehculo) vinculadas con una fiesta en una discoteca. Pero, hasta ahora, siempre que se ha desplegado esta estrategia ha sido a colectivos determinados. En empresas hortofrutcolas de la comarca leridana del Segri o en brotes laborales circunscritos a una compaa tambin se han hecho test masivos a los empleados.En el caso de los municipios del Valls, no obstante, las PCR estn abiertas de forma indiscriminada a todos los vecinos de los vecindarios afectados, y recuerdan a los test por barrios realizados en canchas deportivas a todos los vecinos de ciertos distritos de Pekn. Los tres municipios catalanes tienen una tasa de reproduccin del virus (R) por encima de 1, lo que significa que, de media, un caso infectado contagia a ms de una persona. Los expertos recomiendan que la R est siempre por debajo de la unidad para contener el virus.Los casos registrados en Sabadell en la ltima semana (154, entre el 25 y el 31 de julio) casi se han cuadruplicado respecto a los detectados dos semanas atrs. Cuando tienes un paciente que no sabe dnde lo ha cogido, significa que ya hay transmisin comunitaria. Aqu nos ha pasado poco, pero tenemos miedo a que esto empiece a ocurrir, explica Manel Cervantes, director del servicio de Enfermedades Infecciosas del Parc Taul de Sabadell. El hospital tiene 16 personas con covid-19 ingresadas, aunque ninguna en cuidados intensivos.Estrategia combinadaTerrassa, por su parte, ha registrado los ltimos das de julio 115 nuevas infecciones y cinco hospitalizados, dos de ellos en cuidados intensivos. All tambin se instalarn un par de carpas que, segn el Consistorio, estarn instaladas cerca de los centros de salud Rambla, Norte y Este. Pondremos unidades de asistencia mvil del Sistema de Emergencias Mdicas en zonas de paso, en entornos comunitarios, ha indicado Argimon.La situacin de Ripollet, que ha reportado 22 casos y tres ingresos en la ltima semana, es diferente a la de Terrassa y Sabadell. En su caso, Salud tiene ms acotada la zona donde se ubican el grueso de los contagios y realizar tambin una intervencin puerta a puerta, con mediadores y agentes cvicos de refuerzo. Un antecedente de esta estrategia se realiz en el municipio de Granollers, aunque en pequeas dimensiones (266 PCR hechas).Los expertos coinciden en que el cribado masivo con PCR puede ser efectivo en los municipios del Valls, pero descartan desplegarlo de forma generalizada. Esto ya lo haban hecho en Corea del Sur. No es una buena estrategia para aplicarla de forma indiscriminada, solo en zonas donde se detecta un aumento en un momento determinado. La PCR es una foto del momento y cuando hay un acmulo de casos es una opcin, apunta Cervantes. Coincide Jess Molina Cabrillana, portavoz de la Sociedad Espaola de Medicina Preventiva, Salud Pblica e Higiene: Esta medida est bien para conocer y tener ms informacin y ms detallada de lo que est pasando. Pero la PCR no es una prueba de cribado, solo aplicada en un contexto epidemiolgico concreto tiene utilidad. En este caso, como la incidencia va en aumento, tienen ms probabilidades de encontrar casos asintomticos.Segn Cervantes, la experiencia de los ltimos das refleja que el nivel de transmisin es alto. No es muy cientfico, pero a partir del estudio de contactos, nos salen entre dos o tres familiares por caso, lo que significa que la R es mayor de 2 y esto no est todava controlado. Por ahora es gente sana, sin sntomas. Si no llega a los abuelos, no nos veremos como en marzo o abril, valora.Cabrillana apunta que esta estrategia permitir tomar mejores decisiones. Esto les dar ms pistas de lo que est ocurriendo y caracterizar ms a la poblacin para tomar nuevas decisiones. De hecho, insiste en que la PCR tiene que ir acompaada de otro paquete de medidas: El cribado per se no va a servir de mucho si no va acompaado del aislamiento de los casos, la deteccin temprana y medidas de prevencin. Argimon, que ya restringi el ocio nocturno en la comunidad, no descarta nuevas medidas segn los resultados del cribado.Regar plazas para evitar concentracionesLos casos en Sabadell estn creciendo. La situacin no es para generar alarma, pero hay que actuar, ha valorado la alcaldesa de Sabadell, Marta Farrs. La regidora explic que las dos carpas se instalarn en la zona sur de la ciudad: una de ellas, en la plaza de las Termas y otra, en la plaza Picasso del barrio Campoamor, una zona humilde muy castigada por la covid-19. La alcaldesa seal que, aunque en la zona norte de la ciudad tambin se ha registrado un aumento de casos, en esa zona es ms fcil seguir la trazabilidad de los contactos de los casos positivos.

Por su parte, el alcalde de Terrassa, Jordi Ballart, ha llamado a recuperar la responsabilidad y no relajarse. Adems de las carpas que se instalarn cerca de los centros de salud de los barrios donde se han detectado ms casos, el Consistorio anunci que, durante las prximas noches y como medida disuasoria, se regarn plazas y espacios de la ciudad para evitar la concentracin de personas, mientras que las terrazas de bares y restaurantes debern cerrar a medianoche los fines de semana.Informacin sobre el coronavirus- Aqu puede seguir la ltima hora sobre la evolucin de la pandemia- As evoluciona la curva del coronavirus en Espaa y en cada autonoma- Buscador: La nueva normalidad por municipios- Preguntas y respuestas sobre el coronavirus- Gua de actuacin ante la enfermedad",Catalua har test masivos en tres ciudades para contener el virus,https://elpais.com/espana/catalunya/2020-08-04/cataluna-prepara-cribados-de-covid-19-en-sabadell-terrassa-y-ripollet-ante-el-auge-de-casos.html

"Un abuelo con su nieta en el poyete de un paseo martimo. UNSPLASHHoy hace ocho aos naca mi hijo y mora mi abuelo. Lo hizo, mi abuelo, tras volver de trabajar la tierra: le dio un ictus y se qued en el hospital a la espera de que terminase el parto con el escrupuloso respeto que mi familia siempre tuvo al equilibrio demogrfico. Al morir l se extingui en nuestra estirpe el ltimo eslabn de la conocida tradicin que obliga a los abuelos a darle dinero a escondidas a los nietos, una tcnica depurada que en nada los distingua de un mago o un camello....Inicia sesin para seguir leyendoSlo con tener una cuenta ya puedes leer este artculo, es gratisRegstrateIniciar SesinGracias por leer EL PAS",Un viejo y feliz billete de 50 euros,https://elpais.com/opinion/2020-08-04/un-viejo-y-feliz-billete-de-20-euros.html

"La resolucin de la compra de Air Europa por parte de Iberia se encuentra a punto de ebullicin. Despus de varias semanas de intensas negociaciones, International Airlines Group (IAG), responsable de la antigua compaa de bandera espaola, y la familia Hidalgo, propietaria de Air Europa, quieren cerrarlas antes de septiembre con un final feliz que tambin interesa al Gobierno. Pero para que la operacin acabe en acuerdo tendrn que limar algunas cuestiones pendientes. En todo caso, cualquier acuerdo tendran que aprobarlo los consejos de administracin de Iberia e IAG, por ese orden.El primer escollo que hay que superar es el precio. El pasado noviembre las dos empresas fijaron, en un pacto sorpresa de madrugada, la cifra de 1.000 millones de euros pagaderos a tocateja una vez recibieran el permiso de las autoridades europeas de la Competencia. Pero el presidente de Iberia y futuro consejero delegado de IAG, Luis Gallego, dej claro en la presentacin de resultados semestrales que, tras el impacto de la crisis sanitaria, Air Europa ya no vale lo que vala, por lo que aquel pacto carece de sentido.La nueva realidad a la que apel el ejecutivo getafense obliga a encontrar un punto de encuentro distinto. Y eso supone reducir el precio hasta ms o menos la mitad, segn han reconocido fuentes involucradas en la operacin. Un recorte que implica un quebranto significativo para la familia Hidalgo, que lo apost todo a la integracin en una operacin que resultaba redonda para vendedores y compradores.Pero estall la pandemia y las excelentes expectativas, igual que los aviones, se quedaron en tierra. Y, adems del precio, se pusieron en revisin la forma de pago y varios aspectos tcnicos como clusulas de cumplimiento e, incluso, el permetro de la venta. Es, prcticamente, una nueva mesa de negociacin con todos los elementos cambiados en la que cada jugador ha tenido que variar su apuesta casi sobre la marcha. Pero a todos les interesa acabar bien.Para ello, IAG, que lleva unas prdidas acumuladas hasta junio de 3.806 millones de euros, ha decidido proponer a su junta de accionistas de septiembre una ampliacin de capital de 2.750 millones con la que pretende reforzar la liquidez y poder acometer operaciones como la referida. Para Iberia, aunque no sea a cualquier precio, la operacin sigue siendo estratgica, porque concuerda con sus planes de expansin y a medio y largo plazo aporta valor, segn reconoci Gallego. Adems de evitar la indemnizacin de 40 millones que supondra romper el contrato de noviembre, impedira posibles males mayores, como que un competidor penetre en su territorio de dominio, en el que tiene especial inters Latinoamrica.En ese sentido, Iberia ya se adelant a Air France con el acuerdo del ao pasado y el grupo francs, que ha recibido ayudas pblicas por valor de 8.000 millones euros, vera una oportunidad para devolverle el tortazo a Iberia si la operacin fracasa y Air Europa se queda libre y a la espera de recibir un mejor postor para evitar la ruina. Su propietario, el grupo Globalia, que integra tambin la agencia de viajes Halcn y la cadena hotelera Be Live, necesita apoyo urgente. Ya se acogi a las ayudas del Instituto de Crdito Oficial (ICO) con un prstamo por valor de 130 millones, pero es insuficiente para salvarse.En este punto entra en juego el otro protagonista. El Gobierno ha reiterado que respalda la operacin y, a travs del Ministerio de Transportes, ha estado al tanto de las negociaciones. Para el Ejecutivo es imprescindible que exista un hub (centro de operaciones) de alto nivel en Madrid que est en manos de un grupo espaol y sea capaz de competir con los principales europeos. La obsesin se centra en reforzar el movimiento turstico, la primera industria nacional, ahora muy tocada del ala. A juicio de Luis Gallego, esta se va a recuperar mejor con Air Europa dentro de IAG que por separado. Si se rompe la baraja, las dos aerolneas saldran perdiendo y eso es precisamente lo que no quieren ni ellas ni el Gobierno.Ayudas pblicasEl departamento que dirige Jos Luis balos sabe que tiene que adoptar medidas regulatorias y dotar de un marco necesario para que Globalia pueda beneficiarse de las ayudas que le permitan sanear sus cuentas y pagar las nminas. A ello responde el fondo de 10.000 millones de euros que aprob el Consejo de Ministros recientemente. Segn las fuentes consultadas, se trata de facilitar el acceso a financiacin del grupo presidido por Juan Jos Hidalgo. Se indagan varias frmulas. La posibilidad de que entre dinero pblico en la compaa es algo que, segn las fuentes consultadas, se quiere evitar y que nicamente se procedera en ltima instancia.Que el Gobierno pueda incidir en la estrategia de IAG es para el grupo hispanobritnico una lnea roja que no est dispuesto a dejar traspasar. Iberia, junto a Vueling (tambin integrada en IAG), se acogi a las facilidades del ICO con un crdito de 1.010 millones, y pidi que la garanta estatal se elevara del 70% al 90% de futuros prstamos para ayudar al sector.Luego estn los permisos de Bruselas. La operacin requera, en su diseo inicial, la autorizacin de Competencia, ya que supone la duplicidad de rutas. Ello obliga a que el grupo resultante tenga que desprenderse de algunas de ellas, as como de slots, principalmente vuelos nacionales y europeos. Por eso Iberia y Air Europa haban incluido en el acuerdo a la compaa espaola Volotea para que se quedara con parte de ellas, con lo que allanaban el camino. Ahora, con los ajustes, los derroteros pueden cambiar. De momento, Bruselas ha ampliado el plazo para entregar documentacin hasta septiembre, lo que flexibiliza la urgencia inicial.A medio gas y con fuertes prdidasEl trfico areo dista mucho de la normalidad: los aeropuertos espaoles contabilizaron 2.000 operaciones diarias en julio frente a las 7.700 del mismo mes del ao pasado. As, las dos compaas han retomado sus programas con cautela y a medio gas. Iberia lo hizo con vuelos de corto y medio radio el 1 de julio, ofreciendo solo el 21% de la capacidad prevista y que podra aumentar al 35% en funcin de la demanda segn avance el verano. Air Europa reanud sus vuelos nacionales el 22 de junio y ha ido retomando su operativa europea, pero solo mantiene alrededor de una cuarta parte de sus vuelos, y la prctica totalidad de la flota transocenica en tierra.Iberia registr prdidas operativas de 867 millones en los seis primeros meses, frente a los beneficios de 109 millones en el mismo periodo del ao pasado. El mercado estima que las cuentas de Air Europa sean an peores.",La alianza Iberia-Air Europa entra en ebullicin,https://elpais.com/economia/2020-08-04/la-alianza-iberia-air-europa-entra-en-ebullicion.html

