body,title,url

"Simen de Bulgaria es el nico monarca que se ha presentado a unas elecciones y las ha ganado. Hubo un momento en que quiz el Rey las habra ganado en Espaa de presentarse, especula una persona que trabaj para l. Pero Juan Carlos de Borbn no quera gobernar durante cuatro aos, como le pas al exrey de Bulgaria, que perdi las elecciones siguientes, sino perpetuar su dinasta en la Jefatura del Estado.Los principios no pudieron ser menos prometedores. En la Espaa del tardofranquismo, los monrquicos eran una secta extica que peregrinaba a Estoril (Portugal) para rendir pleitesa a don Juan, un rey que nunca ci la corona. Franco se levant contra la Repblica, pero tard ms de una dcada, hasta 1947, en declarar a Espaa como Reino y an se demor 22 aos ms en designar a Juan Carlos de Borbn como sucesor. Cuando el dictador muri, el nuevo Rey ni siquiera tena la legitimidad dinstica. Su padre se la traspas el 14 de mayo de 1977, solo un mes antes de las primeras elecciones democrticas.Juan Carlos I fue jefe del Estado porque nadie tena una opcin mejor. O fuerza suficiente para imponerla. Franco amag con desplazarlo en favor de Alfonso de Borbn, tambin nieto de Alfonso XIII y marido de su nieta, pero nunca se decidi; y los franquistas no tenan a un Marcelo Caetano (el sucesor del dictador portugus Oliveira Salazar) espaol, una vez muerto Carrero Blanco. La desconfianza hacia el Rey era tal que cuando design al falangista Adolfo Surez como presidente del Gobierno, en vez de elegir al monrquico y liberal Jos Mara de Areilza, hasta Fraga lo interpret como una marcha atrs.El Partido Comunista de Santiago Carrillo acept la bandera rojigualda (es decir, la Monarqua) a cambio de su legalizacin; y el PSOE, tras una defensa testimonial, sacrific la tricolor (republicana) en el altar del consenso. La Constitucin fue el fruto de una gran transaccin, en la que la Monarqua apareca como una carta valiosa, pero no lo bastante como para romper la baraja.En una sola noche, Juan Carlos I pas de ser un peaje que haba que pagar porque Franco haba muerto en la cama a erigirse en salvador de la democracia. Aquel 23-F, con los espaoles encerrados en casa mientras los tanques rodaban por las calles de Valencia y los disparos agujereaban el techo del hemiciclo del Congreso, el Rey se puso el uniforme de capitn general y orden a los golpistas regresar a los cuarteles. Al presidente cataln, Jordi Pujol, le dijo lo que toda la sociedad necesitaba or: Tranquil Jordi, tranquil.Aquella noche de 1981 naci el juancarlismo, un sistema poltico en el que el prestigio del Rey era tan poderoso que poda proyectarse hacia atrs, haciendo olvidar sus orgenes, y hacia delante, legitimando a su descendencia. La Monarqua gustaba tanto ms en la medida en que no pareca una monarqua: en Espaa no haba el lujo, el boato y la corte que caracteriza a las casas reales de mayor abolengo. O al menos no se vea.La sintona personal con Felipe Gonzlez ambos se llevan solo cuatro aos permiti que La Zarzuela y La Moncloa funcionaran en un armnico reparto de papeles. Fueron tiempos en los que Juan Carlos I hizo impagables servicios a Espaa, en expresin del entonces jefe del Gobierno. El Rey puso su agenda internacional al servicio de la poltica exterior y tambin de la econmica, desatascando bloqueos, disipando malentendidos, engrasando negocios. Se convirti, valga por una vez el tpico, en el mejor embajador de Espaa.En esa poca, reconocen quienes le trataron de cerca, la inmunidad del Rey pas de legal a moral. No se trataba solo de que nadie pudiera demandarlo en un tribunal, ya que la Constitucin lo impide, sino de que ninguno de los que le rodeaban se atreva a llamarle la atencin o llevarle la contraria. Poco a poco se fue desprendiendo de quienes, por edad o trayectoria, podan tener autoridad sobre l, como Sabino Fernndez Campo.Los errores que destruyeron el juancarlismoEditorial: La necesaria distancia con el jefe del EstadoFotogalera: La vida de Juan Carlos a lo largo de su reinadoLas aventuras amorosas fueron una constante de Juan Carlos I casi desde el inicio de su reinado. Corinna Larsen no fue sino la ltima de una larga serie de amistades femeninas que sus ayudantes se encargaban de tapar. En ms de una ocasin, los servicios de inteligencia del Estado tuvieron que emplearse a fondo para evitar el escndalo. Los que vivieron aquellos aos alegan que la sociedad espaola era permisiva con las infidelidades sexuales de sus gobernantes. No era algo exclusivo de Espaa: al funeral del expresidente francs Franois Mitterrand acudieron su esposa y su amante durante 32 aos, con la que tuvo una hija.Pero una cosa era tolerar los pecados de la carne y otra, los del bolsillo. Quienes trataron a don Juan, abuelo de Felipe VI, aseguran haberle odo contar cmo Alfonso XIII se march de Espaa con una mano delante y otra detrs. Juan Carlos I naci en el exilio, en Roma (Italia), y haba visto a familias reales destronadas (como la de su cuado Constantino de Grecia), viviendo de la generosidad de parientes ms o menos pacientes. A ello se sumaba el alto tren de vida de sus amistades, entre las que se contaban grandes magnates, con el riesgo de que llegara a considerarse uno de ellos y no el ms alto funcionario del Estado, pero funcionario al fin.En esos aos, ni el PSOE ni el PP, los dos partidos sobre los que se ciment el llamado rgimen del 78, se preocuparon por apuntalar institucionalmente a la Monarqua, para que la Jefatura del Estado no dependiera del prestigio personal de quien la encarnaba.El caso Nos, que acab con la infanta Cristina sentada en el banquillo y su esposo, Iaki Urdangarin, en prisin, abri una primera grieta en la ptrea solidez de la institucin. Tras el accidente de Botsuana, en 2012, todo el edificio empez a desmoronarse. El mensaje no poda ser ms demoledor: mientras la sociedad espaola sufra los efectos devastadores de la crisis econmica, el jefe del Estado cazaba elefantes en frica. Por primera vez, tuvo que escuchar a sus consejeros. El sueo de jubilarse con una princesa alemana se esfumaba. Lo siento mucho. Me he equivocado. No volver a ocurrir, dijo. Pero ocurri.El 6 de enero de 2014, en la Pascua Militar, el Rey se perdi leyendo el discurso. La Casa Real lo excus alegando que una luz lo haba deslumbrado. En realidad, apenas haba dormido. La noche anterior haba estado en Londres, celebrando su 76 cumpleaos. Haba fallado en el cumplimiento de su funcin como jefe del Estado. Menos de seis meses despus, el 18 de junio de 2014, abdic.Felipe VI no fue la primera persona a la que Juan Carlos I confes que estaba sopesando abdicar, pero s la primera a la que se lo comunic cuando la decisin estuvo tomada. Aunque llevaba aos esperndolo, su reaccin inicial fue de sorpresa, por un instante de vrtigo e inmediatamente de aceptacin de que haba llegado el momento de asumir una responsabilidad para la que llevaba toda su vida preparndose, aunque nadie le hubiera preguntado si ya estaba listo.Felipe VI y su padre son muy distintos. El hijo recuerda a su madre: atenta y observadora, parece elevar a su interlocutor mientras lo escucha hasta hacerle sentir el centro del mundo. Todo lo contrario que su padre, bromista y campechano, dispuesto a rebajarse al nivel de la persona ms sencilla para derribar barreras.Segn quienes les han tratado, la relacin entre ambos es afectuosa, pero distante. Las infidelidades y el abandono de la reina Sofa acabaron enfriando el cario del hijo hacia el padre. Desde fuera, lo que se aprecia es, sobre todo, un exquisito respeto. En La Zarzuela, las relaciones personales estn mediatizadas por la liturgia que envuelve a la realeza: el padre es rey antes que padre y se le trata como tal. Hasta que ha dejado de serlo, porque ahora las tornas han cambiado y el rey es el hijo.Tras la decisin del rey emrito de abandonar Espaa anunciada este lunes, Felipe VI est desnudo. Ya no le protege la sombra de Juan Carlos I, sino que le amenaza. La institucin debe sobrevivir sin el padre o contra el padre. Para salvar a la Monarqua, Felipe VI se distancia de Juan Carlos I igual que Juan Carlos I hizo con don Juan en los ltimos aos de Franco. La reconciliacin llegara aos despus, tras convencer a la mayora de los espaoles, y tambin a su padre, de que no haba una opcin mejor.",Ascensin y cada de Juan Carlos I,https://elpais.com/espana/2020-08-03/ascension-y-caida-de-juan-carlos-i.html

"Una rosa amarilla, un diccionario y una mquina de escribir. Es todo lo que necesitaba Gabriel Garca Mrquez (Aracataca, Colombia, 1927-Ciudad de Mxico, 2014) para ponerse en marcha. A los ocho aos, su abuelo le cont que las flores amarillas daban suerte y nunca se volvi a separar de ellas. Durante la entrega del Nobel (1982), llevaba una escondida en el bolsillo. Gabo se consideraba un diccionarero, aunque su relacin con las enciclopedias fue de amor y odio. En 1977, prolog una edicin del Mara Moliner, su favorito. Pero a la vez se inventaba palabras: condolientes, mecedor. Hasta se propuso jubilar la ortografa, sobre todo esa h rupestre.Ve la luz el primer guion escrito por GaboEl difcil homenaje a Garca Mrquez y Vargas LlosaA las mquinas de escribir tambin les declar la guerra. Su primera Remington ardi en el fuego de los disturbios del Bogotazo, en 1948. Una dcada ms tarde, la mquina que concibi en Pars El coronel no tiene quien le escriba haba perdido la tecla de la d por el camino. Para poder terminar el texto tuvo que arreglrselas completando cada c a mano con un palito vertical. Despus se compr una Torpedo alemana y una Smith Corona elctrica. As, hasta el flechazo con Apple. Un eMac de principios de los 2000, una computadora blanca con forma de pepino retrofuturista, sigue an en la mesa de trabajo de su casa en Ciudad de Mxico.No era especialmente fetichista, pero s que fue comprando cada uno de los modelos de Mac que iban saliendo, cuenta su hijo Gonzalo Garca Barcha mirando la espalda ovalada de la mquina. Tras estallar el xito de Cien aos de soledad durante su estancia en Barcelona, la familia lleg a esta casa en 1975, cuando l tena 11 aos y su hermano, Rodrigo, 15. Recuerda que muchas maanas, al volver del colegio, los dos cros cruzaban corriendo el patio con jardn y entraban a saludar a su padre mientras trabajaba en el estudio. Sentado a la mesa donde hoy tambin sigue un jarrn con rosas amarillas y una coleccin de diccionarios en la estantera, Gabo los miraba en silencio con los dedos an sobre el teclado y los dejaba hablar. Muchas veces no sabamos si realmente nos escuchaba. Se concentraba mucho cuando estaba trabajando.La concentracin es una de las caractersticas que ms destacan los que alguna vez le vieron trabajando en su estudio. Ivn Granados fue su bibliotecario personal desde 2007 hasta su muerte en la primavera de 2014. Sola llegar tambin por las maanas. Le saludaba Buenos das, maestro y durante las siguientes tres o cuatro horas apenas intercambiaban palabras. No era nada manitico, no intervena mucho en la organizacin de sus libros. A cambio, lo que necesitaba es que le dejaran trabajar el tiempo que precisaba, cuenta Granados por telfono, que prepara la publicacin de una investigacin sobre la la obra de Gabo adems de una compilacin de textos dispersos del autor colombiano. Tras su fallecimiento, sigui acudiendo a la casa a terminar la tarea. Durante aos, se encarg de dividir los casi 5.000 ttulos en cuatro reas: Una, las traducciones de sus propios ttulos. Dos, diccionarios y enciclopedias. Tres, libros de documentacin con los que preparaba sus obras. Cuatro, la literatura que le interesaba: novela, poesa, ensayo, periodismo, cine y poltica.De pie, mirando de frente a la zona de los ensayos, Gonzalo Garca reconoce un libro importante. Las flores en la poesa espaola, del fillogo Jos Manuel Blecua. Una edicin de 1968, de la editorial Gredos. En casa nunca hubo mucha presin por encaminarnos a la lectura, pero si por ejemplo preguntabas por la poesa, te enjaretaban este libro. Garca, de profesin ilustrador y editor, avisa en todo caso de que ya no quedan en la biblioteca muchos libros de su infancia. Ni tampoco con los que su padre form su cultura literaria. Durante los ltimos aos, la familia ha donado mucho material a la Biblioteca Nacional de Colombia, adems de la parte del archivo que resguarda la Universidad de Texas en Austin.An as, Gonzalo Garca sigue buscando entre los ttulos de la pared. Y aparece una edicin de 1972 del Ulises de James Joyce, ese mamotreto sobrecogedor, como lo llam en sus memorias un Gabo veinteaero. Tambin aparecen copias de El da del Chacal o El conde de Montecristo. Mi padre siempre huy de la solemnidad y nunca hizo distincin entre lo que se llama alta y baja cultura, agarraba lo que poda de todo los lados, explica su hijo sobre su conocida veta popular. Su bibliotecario personal tiene adems un teora complementaria: Esta no es la biblioteca de un coleccionista o de alguien que tuvo la oportunidad de ir guardando sus primeros libros. Es ms bien la biblioteca de un viajante que se asienta definitivamente en Mxico.Antes de instalarse por segunda vez y para siempre en Mxico a los 52 aos, el escritor colombiano tuvo una vida errante: Barranquilla, Bogot, Pars, La Habana, Caracas, Londres, Barcelona. Adems aade Granados ley sus primeros libros prestados. En sus memorias explica cmo descubri por los libros de sus amigos a Kafka o Faulkner. Pese a todo, la biblioteca del viajante tambin guarda joyas. Como unos 20 volmenes de la legendaria La Pliade, la coleccin de Gallimard que rene el canon de la literatura universal a travs de antologas de los grandes textos, encuadernados en tapas robustas de cuero flexible y delgadas pginas en papel semibiblia.El vallenatoLo que nunca le falt a Gabo en ninguna de sus etapas fue el vallenato, su msica favorita. Tanto, que le gustaba decir que Cien aos de soledad no es ms que un vallenato de 450 pginas. Sus amigos le enviaban cintas desde el Caribe colombiano. Algunas siguen aqu, junto a Roco Jurado, Perales, Manzanero o Sabina. El estudio de la casa mexicana, un amplio corredor de ladrillo blanco en forma de ele, tiene las paredes convertidas en estanteras. Acompaando a los libros tambin hay sofs y sillones y mesas para reposar y charlar. Esta biblioteca fue por las maanas el bnker de trabajo de Gabo. Por las tardes, el centro de operaciones de muchas parrandas. Tena un bar siempre muy bien dotado, recuerda su hijo. Fidel Castro, Sean Penn o Silvio Rodrguez fueron algunas de las muchas e ilustres visitas. Cuando la fiesta era entre escritores, jugaban a que uno empezaba a recitar un verso de Lorca, o de algn poeta espaol del Siglo de Oro, y los dems tenan que seguir con la estrofa.Una copia gigante del retrato que le hizo Richard Avedon en los setenta manda en una de las paredes. Ms fotos: sus hijos, su esposa, sus padres, Hemingway, Gabo con Rulfo, con Felipe Gonzlez, con Bill Clinton. Los personajes histricos tambin fueron personajes de sus novelas. Retratados con un rigor matemtico, heredero quiz del pedigr periodstico del autor. Para El general en su laberinto, que narra los ltimos das de Simn Bolvar, Gabo se sumergi a fondo en los 34 tomos de las memorias de Daniel Florencio OLeary, el general irlands que acompa al libertador hasta su tumba. Volva una y otra vez a las fuentes histricas para, muchas veces, simplemente confirmar la verosimilitud de una escena. Por ejemplo, cuando quiso describir al general comiendo una pieza de mango y fue a conformar si, a principios de siglo XIX, el cultivo del mango haba llegado ya a la actual Colombia.Ms de seis aos despus de la muerte de Gabo, siguen llegando a la casa paquetes con libros. Muchos de autores primerizos, que continan buscando la aprobacin del maestro. La familia reconoce que, como ya no tienen quin los lea, han encontrado para ellos un destino mejor. Gracias a un acuerdo que valid en vida el propio Gabo, todos los meses envan unas cajas con libros a la biblioteca de una Escuela rural agropecuaria de un pequeo pueblo de Sinaloa (Mxico). Y a cambio, ellos les mandan cajas con lichis y camarones.","Gabo, la biblioteca de un viajero",https://elpais.com/revista-de-verano/2020-08-04/gabo-la-biblioteca-de-un-viajero.html

"Prototipos desarrollados en el proyecto Clothilde manipulando un textil.Laboratorio de Vida Asistida, Instituto de Robtica e Informtica Industrial (CSIC-UPC)En estos aos estamos viendo la ampliacin de la robtica del campo industrial aplicada, por ejemplo, en la fabricacin de automviles al rea asistencial o colaborativa, centrada en las personas. En un futuro prximo, los robots que alimentan, o que nos ayudan a limpiarnos o a vestirnos, sern objetos cotidianos. Su desarrollo abre un abanico de nuevos retos, tanto ticos como matemticos.Se asume que la robtica asistencial ser usada por personas de diversa formacin, en residencias, hospitales, centros de rehabilitacin, o incluso en casa, por lo que no puede contar con programadores expertos para su funcionamiento diario, sino que deber incorporar procedimientos sencillos para transmitir las instrucciones, a travs de la teleoperacin o el guiado kinestsico. Adems, estos robots han de ser muy personalizables, es decir, se han de poder adaptar a las capacidades y preferencias de cada usuario concreto, y mejorar sus prestaciones con la experiencia. Todo esto es posible gracias a sofisticadas herramientas de aprendizaje automtico, combinadas con tcnicas de representacin de estados y movimientos basadas en geometra computacional y topologa combinatoria.Pese a los grandes avances en este campo, hay situaciones que siguen siendo poco manejables para los robots. Por ejemplo, la manipulacin de objetos deformables, como textiles. La principal dificultad proviene de la gran cantidad de grados de libertad necesarios para caracterizar el estado de un objeto no rgido y tambin de las incertidumbres que aparecen en la percepcin y la accin del robot.El objetivo de CLOTHILDE es desarrollar una teora de la manipulacin verstil de ropa, que podr ser aplicada en diferentes contextosEn este reto se centra CLOTHILDE, un proyecto financiado por el Consejo Europeo de Investigacin (ERC) y liderado por Carme Torras, del Institut de Robtica i Informtica Industrial (CSIC-UPC). Su objetivo es desarrollar una teora de la manipulacin verstil de ropa, que podr ser aplicada en diferentes contextos. En primer lugar, para disear y programar robots que ayuden a vestirse a personas con movilidad reducida. Tambin ser til en robots para la logstica hospitalaria (por ejemplo, para hacer camas), y para gestionar la devolucin de ropa comprada online. En este ltimo caso, de momento la revisin y plegado de las prendas devueltas la hacen humanos, pero hay un gran inters por parte de la industria por automatizar estos procesos.Los robots aprendern a travs de demostraciones de personal no experto. Estos ejemplos se codificarn en un espacio de estados lo ms reducido posible mediante procedimientos de topologa computacional, como complejos celulares y homologa persistente, y despus se optimizarn con herramientas de aprendizaje automtico. La topologa se emplea para representar los espacios de configuraciones tanto del robot como de la ropa, con el fin de obtener una descripcin lo ms global y sucinta posible de la disposicin de la prenda. No interesan detalles como arrugas, sino que se busca identificar puntos caractersticos de cada disposicin, como, por ejemplo, la ubicacin de las esquinas de la ropa.El aprendizaje automtico se emplea para reconocer los estados de la ropa por visin, una vez el algoritmo ha sido entrenado con miles de imgenes obtenidas por simulacinUna vez construido el espacio de configuraciones, se estudian sus singularidades, es decir, los puntos en los que se pierde algn grado de control del robot, precisamente en los que pueden aparecer movimientos raros, que hay que contemplar y dirigir. El aprendizaje automtico se emplea para reconocer los estados de la ropa por visin, una vez el algoritmo ha sido entrenado con miles de imgenes obtenidas por simulacin, y tambin permitir optimizar los movimientos del robot para manipular la ropa.Es importante tener en cuenta que todos estos avances tambin comportan riesgos. Carme Torras aboga por reflexionar sobre la manera en la que nos va a modelar la tecnologa que desarrollamos. Por ejemplo, la creacin de vnculos emocionales con robots cuidadores podra distorsionar la empata humana, o nuestra capacidad de relacin; o tambin puede propiciar el aislamiento del usuario, si cubre sus necesidades informativas y relacionales. Estos temas se consideran en una nueva disciplina llamada robotica, que ya se est empezando a incorporar como asignatura en algunas carreras de ingeniera e informtica en EE UU. En particular, la investigadora ha desarrollado unos materiales para impartir dicha asignatura basados en su novela de ciencia ficcin La mutacin sentimental, traducida al ingls como The Vestigial Heart (MIT Press), que estn siendo usados en diversas universidades, tambin en Europa.gata A. Timn G Longoria es responsable de Comunicacin y Divulgacin del ICMATCaf y Teoremas�es una seccin dedicada a las matemticas y al entorno en el que se crean, coordinado por el Instituto de Ciencias Matemticas (ICMAT), en la que los investigadores y miembros del centro describen los ltimos avances de esta disciplina, comparten puntos de encuentro entre las matemticas y otras expresiones sociales y culturales y recuerdan a quienes marcaron su desarrollo y supieron transformar caf en teoremas. El nombre evoca la definicin del matemtico hngaro Alfred Rnyi: Un matemtico es una mquina que transforma caf en teoremas.Puedes seguir a�MATERIA�en�Facebook,�Twitter,�Instagram�o suscribirte aqu a nuestra�newsletter",Matemticas para que los robots nos ayuden a vestirnos,https://elpais.com/ciencia/2020-08-04/matematicas-para-que-los-robots-nos-ayuden-a-vestirnos.html

