body,title"La inclusión del magnate de origen ruso Evgeny Lebedev, hijo de un exagente del KGB, en la lista de designados por el gabinete británico para ocupar un asiento en la Cámara de los Lores ha suscitado una oleada de críticas entre quienes subrayan su estrecha relación con el actual primer ministro. Boris Johnson podría argumentar a la contra que se trata de una prerrogativa a la que sus antecesores en Downing Street han venido recurriendo para elegir a dedo a amigos, compromisos y, sobre todo, donantes del partido de turno en el poder. Es preceptivo que Isabel II sancione esa nómina, pero se trata tan sólo de un trámite porque la reina acata las decisiones del Gobierno electo.El patrocinio gubernamental de Lebedev junior, nacido en Moscú hace 40 años pero criado en el Reino Unido, viene justificado tanto por su preeminencia en la prensa del Reino Unido (es el principal accionista del diario digital The Independent y propietario del vespertino gratuito Evening Standard, leído por millones de londinenses a diario en el metro) como por su papel en la protección de animales en riesgo de extinción. Esta última, una causa loable para la que ha conseguido captar unos fondos que rozan los 60 millones de libras (66,5 millones de euros), según datos de los propios medios que controla.Pero su nominación a ese puesto en los Lores, que detentará con carácter vitalicio, ha venido a subrayar el amiguismo que entraña la designación de nuevas adiciones a una Cámara cuyos escaños no responden al sufragio de los ciudadanos del Reino Unido. El mérito de Evgeny Lebedev, a decir de quienes exigen una reforma de la Cámara alta o incluso su supresión, es el de haber entablado una amistad con Johnson hace más de una década, y promovido después su figura desde los editoriales del Evening Standard cuando afrontaba una difícil reelección como alcalde de Londres, en 2012.La lista de futuros peerage (integrantes de la Cámara de los Lores) que el Gobierno tory ha presentado a la soberana incluye, amén de a destacados donantes del Partido Conservador, a uno de los hermanos del jefe de Gobierno. La designación de Jo Johnson, quien dimitió de una cartera de segundo rango del Gobierno por su disconformidad con el objetivo de un Brexit duro y sin compromisos con la UE, no ha sido caracterizada sorprendentemente como un caso obvio de nepotismo. Lo que la prensa local ha detectado es el esfuerzo del líder tory y jefe del Gobierno en tender puentes con ese ala del Partido Conservador que, si bien acepta que el Brexit es una realidad, no está de acuerdo con una ruptura abrupta de lazos con Europa y sin que medie un acuerdo. Por eso dos de los otrora pesos pesados del partido, los exministros de Economía y hasta ahora relegados Kenneth Clarke y Philip Hammond, ocuparán pronto un escaño en la Cámara de los Lores.La lista elaborada por el Gobierno siempre depara sorpresas, pero ninguna como la concesión del rol de fututo lord al marido de la ex primera ministra británica Theresa May, Philip. ¿Lo pidió ella o ha sido la última afrenta de Johnson a su antecesora contra la que maniobró hasta hacerla caer? Ese es uno de los pocos interrogantes que plantea la lista de elegidos para un puesto no electo y cada vez más cuestionado, entre los que destaca, por ejemplo, una gloria del cricket inglés (sir Ian Botham) cuyo exitosos currículo deportivo no ha sido, al parecer, tan importante como su posicionamiento a favor de un Brexit sin ambages","Los nuevos lores de Boris Johnson: un magnate ruso, un hermano y el esposo de May"
"El presidente del Gobierno y secretario general del PSOE, Pedro Sánchez, se opondrá rotundamente a quienes planteen abrir el debate sobre monarquía o república al calor de las irregularidades financieras de Juan Carlos I y su salida de España. El jefe del Ejecutivo apela a mantener la fortaleza de las instituciones, y singularmente la Corona, en medio de la crisis de la covid-19. Frente a sus socios de gobierno de Podemos, que han elevado sus críticas a la monarquía tras la marcha del rey emérito, Sánchez proclamó este martes que “el pacto constitucional está plenamente vigente” y en él está “la monarquía constitucional”. La salida de España de Juan Carlos I tras el escándalo de sus supuestas irregularidades financieras, investigadas por la justicia en España y Suiza, ha abierto una nueva fisura entre las fuerzas políticas. Los partidos independentistas y Unidas Podemos ven en este episodio la oportunidad de abrir el debate de la forma de Estado. El auge del republicanismo ya planeó en 2012, cuando, en plena crisis económica, se conoció la estancia del anterior rey en Botsuana junto a su amiga Corinna Larsen, en una cacería de elefantes. Su reputación ya no se enderezó y abdicó en junio de 2014, en una operación en la que el PP y el PSOE estuvieron en primera línea de defensa de la institución. Entonces gobernaba el PP, ahora el PSOE, en coalición con Unidas Podemos. Pero a pesar de la postura de sus socios de Ejecutivo, la defensa de la monarquía por parte de Sánchez no deja lugar a dudas. Este martes, en la rueda de prensa tras el Consejo de Ministros para despedir el curso político, el presidente alabó la decisión de Felipe VI de “distanciarse” de las “supuestas conductas cuestionables y reprobables” de su padre. No hay debate para Sánchez, que considera “plenamente vigente” el pacto constitucional de 1978, del que forma parte “la monarquía constitucional”. Si hay hechos delictivos o irregulares afectarán a Juan Carlos de Borbón, no a la Corona como institución. “Se juzgan personas, no instituciones”, proclamó Sánchez.Su balance de siete meses de Gobierno quedó sepultado ante el interés de conocer detalles sobre la salida del rey emérito. Sánchez se amparó en el carácter confidencial de las reuniones entre el jefe del Estado y el presidente del Gobierno y esquivó las preguntas sobre a qué país ha decidido trasladarse Juan Carlos I o quién pagará su servicio de seguridad y otros gastos. El interés de Sánchez era lanzar un mensaje claro en defensa de la monarquía constitucional, porque, según él, no existen motivos para ponerla en jaque y, hacerlo, además, generaría una inestabilidad indeseable en plena crisis sanitaria y económica por la pandemia. “España necesita estabilidad e instituciones robustas”, afirmó Sánchez, que consideró “adecuada” la línea emprendida por el Rey. “Felipe VI está tomando medidas de transparencia y ejemplaridad que todos los españoles deben valorar”, señaló. “Siempre he defendido que para que haya una democracia fuerte, sus instituciones tienen que ser robustas y las decisiones del Rey van en esa dirección”, insistió.El presidente y el Monarca han hablado de cómo actuar ante las nuevas revelaciones sobre sociedades y cantidades millonarias ajenas al fisco español de Juan Carlos I. Pero ahora están exclusivamente centrados en vencer el desapego hacia la Corona que pueda haber en la opinión pública. Los partidos republicanos ya lo manifiestan a las claras. Sánchez expresó el “absoluto respeto” del Gobierno por las decisiones de la Casa Real sobre el rey emérito. A la aceptación —o quizá la sugerencia— de don Felipe de la salida de España de Juan Carlos I, se suma la decisión del Monarca de renunciar a la herencia de su padre, lo que supone dar por bueno que tiene dinero obtenido de forma dudosa, y retirarle su asignación económica. . La situación no es fácil para el presidente del Gobierno, por cuanto su defensa de la monarquía choca con la posición de sus socios en el Ejecutivo, beligerantes siempre con la institución real y mucho más con la actuación presuntamente irregular del anterior monarca. Pero, hoy por hoy, como ocurre desde hace 40 años, la cúpula del PSOE defiende la monarquía constitucional. Frente a la posición del sector mayoritario del Gobierno, los partidos nacionalistas e independentistas que consintieron la investidura de Sánchez y sus propios socios en el Ejecutivo, encabezados por el vicepresidente segundo, Pablo Iglesias, y la ministra de Igualdad, Irene Montero, consideran “indigna” la “huida” de España del anterior monarca. “El secreto y la confidencialidad” de los despachos con el Rey fueron esgrimidos varias veces por Sánchez para justificar que no tiene por qué dar a conocer ni a sus socios ni a nadie lo que ambos tratan. Y es que el presidente del Gobierno no informó ni a Unidas Podemos ni al PP ni a Ciudadanos de que el rey emérito iba a abandonar España. La jornada de este martes era la prevista para que Sánchez diera cuenta del balance de sus siete meses de Gobierno de coalición, pero se cruzaron la cuestión real y los enfrentamientos con Unidas Podemos, estos últimos por varias razones, entre ellas, la Monarquía y la relación que el PSOE cultiva con Ciudadanos. El sector de Podemos en el Gobierno se desvinculó de los contactos entre el Ejecutivo y la Casa del Rey para la salida de España de Juan Carlos I. Esa decisión, afirmó este martes Irene Montero, “no la ha tomado” el Gobierno de coalición: “Puede ser que haya sido el PSOE desde La Moncloa”, apostilló la ministra en la Cadena SER. Iglesias remachó las críticas en otra entrevista en Tele 5. Reconoció que en el Parlamento no hay apoyo suficiente para cambiar la forma de Estado, pero profetizó: “Tarde o temprano, los jóvenes impulsarán una república en España”.Estos días van a proliferar iniciativas parlamentarias sobre Juan Carlos I y Felipe VI, sobre empresas que pudieron premiar al primero por supuestas gestiones, además de la reclamación a la Fiscalía para que se mantengan las investigaciones. Unidas Podemos coincidirá con algunas de ellas y se producirá la situación de que el PSOE votará contra las propuestas de sus aliados. Sánchez acoge estas divergencias con aparente naturalidad. “Somos dos fuerzas diferentes, con posiciones dispares en muchos temas”, recordó. En ese punto, Iglesias sí que se expresó en términos parecidos. Señaló que “a nadie puede sorprender que haya discrepancias” entre dos partidos diferentes, pero apostilló que “el Gobierno de coalición tiene muchos años por delante”. “Cuando en el marco de la coalición hay una situación molesta”, apuntó el vicepresidente segundo, “eso lo resolvemos Pedro Sánchez y yo”.","Pedro Sánchez defiende a la Casa del Rey: “Aquí no se juzga a instituciones, se juzga a personas”"
"La marcha de Juan Carlos I de España se decidió en una reunión directa entre Felipe VI y su padre, después de que, a través de intermediarios, no se hubiera logrado un acuerdo sobre la forma de evitar que el escándalo en torno a las cuentas de este último en paraísos fiscales dañase a la Monarquía. El Gobierno estuvo al corriente de las conversaciones, pero la decisión última fue de Felipe VI, como subrayó ayer el presidente Pedro Sánchez. Juan Carlos I abandonó el domingo La Zarzuela y cruzó el lunes la frontera de España con Portugal, aunque este país puede no ser su residencia definitiva.Juan Carlos I salió el pasado domingo del Palacio de La Zarzuela, su hogar durante los últimos 58 años, y se dirigió a la localidad pontevedresa de Sanxenxo, donde pernoctó en casa de su amigo Pedro Campos. A la mañana siguiente, cruzó la frontera con Portugal, pocas horas antes de que La Zarzuela anunciara, mediante un comunicado oficial, su salida de España. Aunque algunos medios aseguraron que en Oporto tomó un avión con destino a la República Dominicana, distintas fuentes han confirmado a EL PAÍS que el padre del Rey no viajó a la isla caribeña.Ese fue el desenlace hasta ahora de una decisión madurada durante semanas, fruto de unas conversaciones a tres bandas (con representantes de la Casa del Rey, de Juan Carlos I y de Presidencia del Gobierno) en las que se analizaron todas las alternativas posibles para minimizar el daño a la Monarquía de la investigación abierta por los fiscales suizos y españoles sobre las cuentas opacas del rey emérito. Y en las que se perfilaron todos los detalles, incluida la forma de presentar su resultado definitivo ante la opinión pública. Al final, tuvo que ser un encuentro directo entre el Rey y su padre el que desatascara un asunto en el que, según reconocen las fuentes consultadas, “no había solución buena, sino menos mala”.Para Juan Carlos I, la línea roja fue conservar el título honorífico y vitalicio de rey, que se le concedió por real decreto en junio de 2014, pocos días antes de su abdicación. Para Felipe VI, el objetivo era que la solución fuera aceptada voluntariamente por su padre y que no se tratara de una imposición externa.Juan Carlos I, según las mismas fuentes, buscaba a toda costa recuperar su imagen pública, gravemente dañada por el goteo de informaciones sobre su relación con la alemana Corinna Larsen, y llegó a plantear incluso la renuncia a su inmunidad constitucional, lo que se descartó por jurídicamente inviable.También se debatió la posibilidad de que realizara una regularización fiscal de su patrimonio personal. Se trataba de ir más allá de lo que obliga la ley, que fija en cinco años la prescripción de los delitos fiscales. El problema, según las fuentes consultadas, era que la cantidad a pagar (más de 60 millones, si afloraba la donación del rey saudí) estaba fuera de las posibilidades actuales del rey emérito. Y no había garantías de que, tras realizar una completa confesión tributaria, Corinna Larsen no le acusara de ocultar alguna propiedad a nombre de terceros.La salida consensuada entre padre e hijo, y aceptada por La Moncloa, fue el alejamiento físico del anterior jefe del Estado, su salida al extranjero. A partir de ese momento, explican las mismas fuentes, hubo que analizar a qué país iría a vivir y cómo se mantendría en el futuro.Felipe VI le retiró en marzo pasado la retribución anual de casi 200.000 euros que recibía de los Presupuestos Generales del Estado, por lo que don Juan Carlos ha tenido que echar mano de sus ahorros, según fuentes de su entorno, y de la generosidad de sus amigos, que en algún caso no ha sido tan espléndida como podría esperarse. Primer destino, Portugal La elección del país donde residirá no fue menos difícil, pues hubo que descartar varios de los destinos preferidos del rey emérito. Finalmente, partió hacia Portugal, aunque eso no significa que se instale allí definitivamente.Respecto a la presentación de la noticia, se optó por una carta de Juan Carlos I a su hijo, que la Casa del Rey hizo pública a través de un comunicado junto al “sentido respeto y agradecimiento” de Felipe VI. En cambio, se prefirió que fuera el abogado del rey emérito, Javier Sánchez-Junco, quien hiciera público su compromiso de estar a disposición permanente de los fiscales que investigan su caso. Se trataba de no mezclar de ninguna manera a la Casa del Rey con los problemas judiciales que pueda tener don Juan Carlos.Las fuentes consultadas no tienen ninguna duda de que el rey emérito acudirá ante los tribunales si es requerido. De no hacerlo causaría un daño irreparable a la institución, que ha avalado públicamente su salida de España.Consensuada la decisión y la forma de presentarla, se trataba de elegir el momento. Y fue Felipe VI quien decidió esperar a completar la gira que, junto a la reina Letizia, inició tras levantarse el estado de alarma por las 17 comunidades autónomas y concluyó la semana pasada.Aunque todo se acordó, siempre caben interpretaciones. El rey emérito ha contado a varias personas que su marcha es temporal (“un paréntesis, no unas vacaciones”, le ha dicho al columnista Alfonso Ussía, según aseguró este el martes) y que volverá pronto a España. Otros, en el Gobierno, no creen que sea tan fácil. ",Felipe VI pactó en un encuentro con Juan Carlos I su salida de España
"El 31 de julio la sala Bonhams de Nueva York subastó uno de los 20 bancos que Antonio Gaudí diseñó para la cripta de la Colonia Güell en Santa Coloma de Cervelló que, antes del coronavirus visitaban, junto con sus otros seis edificios de Barcelona declarados Patrimonio de la Humanidad, más de 10 millones de personas al año. El mueble tenía un precio de venta entre 170.000 y 260.000 euros. No encontró comprador. Y la fallida subasta puso de manifiesto los problemas de autenticidad que pesan sobre muchos de los objetos creados por el arquitecto catalán.La historia de los bancos de este edificio que Gaudí dejó a medias en 1914 para centrarse en la Sagrada Familia es digna de una novela de intriga. Los diseñó para los habitantes de la colonia textil con, marca de la casa, materiales reciclables que tenía a mano: la madera de roble inglés de las cajas en la que viajaban desde el Reino Unido la maquinaria para la fábrica y los flejes de hierro de las balas de algodón importado desde Egipto y empleado para elaborar los tejidos. Gaudí encargó los trabajos al carpintero de la localidad, Tomàs Bernat, y le pagó, entre 1913 y 1914, un total de 400 pesetas, 20 por cada uno de ellos, como puede leerse en un recibo conservado en el Museo Diocesano de Barcelona.Lo que no se sabe a ciencia cierta es lo que pasó después con ellos. Según explicó en 1989  Joan Bassegoda, uno de los mayores especialistas en Gaudí, siete acabaron calcinados en la Guerra Civil. “Doce son los que hay en primera fila de la cripta y el otro está en la Casa Gaudí del Parque Güell”, escribió. En el catálogo de la exposición sobre modernismo de 1990 se decía que “solo quedaban cuatro o seis bancos”, y en un libro publicado en 2003 sobre la historia de la Colonia se apuntaba que “muchos desaparecieron durante los años cincuenta y sesenta y solo quedaron tres originales”. “Fue entonces cuando se construyeron los actuales”. Investigadores más recientes ponen en duda la afirmación de Bassegoda sobre la destrucción por el fuego que el experto achacó a casi todo lo relacionado con el trabajo y los talleres del arquitecto y diseñador. Sí hay constancia de que en 1972 el párroco de la cripta, para hacer frente a los gastos del edificio en un momento de crisis generalizada del textil, vendió cinco de los bancos al coleccionista de París Pedro Uhart por dos millones de pesetas cada uno (12.000 euros). Los 15 restantes fueron trasladados a Barcelona por el obispado. Uno de ellos se expone en el Museo Diocesano de esta ciudad y otro, desde 2014, en el Museo Nacional de Arte de Cataluña.Dos de los cinco bancos vendidos a Uhart han acabado en el MoMA de Nueva York, que cuenta con uno de ellos desde 1976, y en el Centro de Creación Industrial de París. Allí llegó en 1977 y, tras pasar a los dos años al Museo de las Artes Decorativas, acabó en 1993 en el Museo de Orsay junto a otras piezas diseñadas por Gaudí. El resto de los bancos se han subastado en Nueva York, París y Londres y han ido pasando de un coleccionista a otro a lo largo de los años. En 1979, Christie’s vendió uno por 379.000 euros; en 2011, Sotheby’s, otro por 385.000 euros. En 2013, Christie’s volvió a subastar el de 1979, pero se quedó sin comprador. Dos años después Sotheby’s subastó por solo 182.447 euros uno, propiedad de uno de los grandes coleccionistas de Gaudí, Allan Stone, que ese mismo día también vendió por 68.400 euros dos puertas del oratorio de la Casa Batlló. En 2016, Christie’s vendió por 382.144 euros uno más, y en noviembre de 2019 la misma casa subastó el último (hasta el pasado viernes), por 225.000 euros. Son cifras astronómicas si tenemos en cuenta que hace poco más de un siglo costaron 12 céntimos de euro.Pero el lío no termina ahí. Esos 20 bancos no son los únicos de la cripta de la Colonia Güell que se conocen: hay uno en el Museo del Hermitage ruso; otro está en manos de un coleccionista privado alemán que lo compró en 1996 y un tercero, en los fondos del pintor francés Sam Szafran, que lo ha retratado en muchas de sus obras, aumentando este galimatías gaudiniano, en el que suman más bancos que piezas hizo Gaudí. Los especialistas coinciden en que esos tres últimos son réplicas. Según Bassegoda, entre los años 1960 y 1967, la carpintería Gurt de Barcelona hizo unas 70 copias para reemplazar el mobiliario de la cripta, muchas de las cuales, no todas, se conservan y se usan cada vez que hay una ceremonia religiosa (ahora, por el coronavirus, solo está abierta a las visitas los fines de semana).“Gaudí es muy complicado. De este original se hicieron muchas copias y cuando sale una pieza a la venta nunca sabes si es original o no lo es”, asegura Antonio Sama, profesor de Historia del Arte de la Universidad Complutense y encargado por Bonhams de hacer un informe y un certificado de autenticidad para la venta del banco el pasado viernes. Sama no tiene una explicación a por qué no encontró finalmente comprador. “He comparado el banco, en manos del mismo propietario desde que lo compró en 1977, con los conservados Museo Diocesano de esta ciudad y otro, desde 2014, en el Museo Nacional de Arte de Cataluña, y es casi idéntico en técnica y material y muy diferente de las copias posteriores”, explica Sama, que destaca como pruebas determinantes “la madera usada, el ensamblaje del metal, con remaches y no con fundición y la talla a mano del elemento decorativo de la venera en la parte central del asiento”. Sin embargo, también destaca la dificultad de su trabajo por “no haber ningún banco igual, al no ser piezas seriadas y estar hechas con materiales reciclados”.Para Sama, el hecho de que el banco no se haya vendido, “tiene que ver quizá con que esté pasando el boom Gaudí y los coleccionistas prefieran ahora piezas más recientes; porque ya son dos los bancos que no se han vendido”, en referencia al de 2013 que no encontró pujador. También, “a que se hayan subastado piezas atribuidas a Gaudí, como un banco de piedra en 2013, sobre el que había muchas dudas entre los expertos. Eso le hizo mucho daño”.Según  Luis Gueilburt, el número de bancos originales no está claro, “posiblemente porque tras la marcha del arquitecto, el párroco encargó más al carpintero; 20 eran pocos para los 700 habitantes que tenía entonces la colonia, de los que 600 seguro que asistirían a misa. Son réplicas, sí, pero hechas igual que los 20 primeros y en vida de Gaudí”. Este experto en los muebles del arquitecto lleva años reclamando “una fundación que vele, como lo hace la de Gala-Salvador Dalí por la obra y el legado del pintor surrealista, y determine de una forma clara lo que creó Gaudí y lo qué no, y estudie en serio su mobiliario, algo que nadie ha hecho hasta ahora y que es totalmente necesario para alejar dudas y conseguir mejores cotizaciones”. Aunque remacha: “Para saber si una silla o un banco son de Gaudí, no hay nada más que sentarse. La diferencia entre una original y una copia, por muy bien hecha que esté, se nota al sentarse”.Y eso, a pesar de que los bancos que hizo Gaudí para la cripta son intencionadamente incómodos para evitar que el fiel se relaje y así esté pendiente de la ceremonia. El arquitecto no dejaba nada a la improvisación, por eso dibujó la planta del asiento con una ligera forma en V que impide que las dos personas que estén sentadas a la vez puedan hablar entre ellas.",Gaudí: un legado incómodo
