body,title,url
"Los cementerios dicen a veces ms de las sociedades condenadas al silencio que el bullicio de sus calles. La tumba de Lorenzo Cimarosa, un pequeo empresario de Castelvetrano (Sicilia) que rompi el muro de la omert en torno al hombre ms buscado de Italia, amaneci destrozada hace poco ms de un ao. Nadie se esforz en buscar a los culpables. No haca falta. Desde su modesta lpida, con inscripciones familiares que recuerdan su valor y valenta en el ltimo ao de su vida, puede verse reflejado el sol de la tarde en el ostentoso y lujoso panten de la familia Messina Denaro. Don Ciccio, el patriarca, fue un capo mafioso que vivi y muri huido de la justicia. Comand con mano de hierro cuando fue invisible y la polica solo pudo encontrarlo cuando ya haba muerto. Una inspiracin perfecta para lo que habra de vivir su hijo, Matteo Messina Denaro, autor de una cincuentena de homicidios incluidos nios y mujeres embarazadas y de los atentados ms sangrientos de la Cosa Nostra en los aos noventa del siglo pasado. Hoy dirige su organizacin mafiosa escondido en algn lugar del mundo 27 aos despus de desaparecer. Su caza se ha convertido en una cuestin de Estado.El viejo Lorenzo Cimarosa no fue nada de eso. Tuvo solo la mala fortuna de emparentarse en los aos noventa con Rosa Filardo, una prima de la familia que controlaba los negocios de la Cosa Nostra en la provincia siciliana de Trapani. En el lbum de boda que corre por casa, un viejo casern en una finca con caballos que gestiona su hijo Giuseppe, aparece junto a un tipo alto, delgado y con un blazer cruzado. Matteo Messina Denaro no fue a la iglesia ese da, vena de ser interrogado en la comisara. Se present directamente en el restaurante y se fotografi con la pareja de recin casados. Guapo, carismtico y algo misterioso. Nunca ms volvieron a cruzarse en su camino. Cimarosa, en cambio, se vio arrastrado a poner al servicio de aquel hombre y su fuga la pequea empresa de construccin de la familia. El clan mafioso le abraz primero, le exprimi y termin abandonndole cuando fue encarcelado. Cimarosa muri aos despus mientras cumpla arresto domiciliario en su casa en las afueras del pueblo, algo destartalada y donde en 2013 se abri la nica grieta en la omert en torno al gran capo.Cimarosa se convirti en 2013 en el primer pentito [arrepentido en el lxico de la mafia] del entorno del capo de Castelvetrano. Su hijo Giuseppe (37 aos), que arrastra la carga de aquel pasado, empuj al padre a cambiar de bando la ltima vez que termin entre rejas. Fuimos a verle a la crcel. Nos sentaron en una sala solos. Yo estaba muy enfadado, odiaba ese mundo. Pero nos dijo que haba empezado a hablar con los magistrados. Cuando salimos, ya todo el pueblo saba que haba empezado a colaborar, recuerda su hijo. Condenaron a media familia Messina Denaro, se incautaron de decenas de bienes. Todava ahora hay arrestos semanales gracias a aquella confesin. Elegimos la libertad, recuerda Giuseppe, mientras por el saln asoma su abuela, la persona que ayud a nacer a Messina Denaro hace 58 aos. Aqu el gnster sigue siendo un hroe y ellos, solo unos apestados.Castelvetrano (30.893 habitantes), un pueblo de la provincia de Trapani cuyo Ayuntamiento ha estado intervenido durante aos por delitos de mafia, es a las cinco de la tarde un erial. Los balcones cerrados, las calles vacas. En el centro comercial, construido con dinero aportado por la organizacin mafiosa, un comerciante resume un siglo de historia criminal. Son todo inventos de la prensa. En este pueblo todos los negocios tienden a ser efmeros, lamenta en su despacho el alcalde, Enzo Alfano (Movimiento 5 Estrellas). Al fondo de un callejn, un edificio humilde, algo desvencijado y amarillento, esconde los secretos de la familia ms escurridiza de la historia de la Cosa Nostra. Hoy aqu solo vive una anciana. Pero vio nacer y crecer al gnster, ltimo heredero del clan de los Corleoneses, autores intelectuales de los atentados en los aos noventa que terminaron, entre otros, con la muerte del juez Giovanni Falcone junto a su escolta y esposa y su adjunto, Paolo Borsellino, solo 57 das despus.Messina Denaro, tambin apodado USiccu (El Seco) o Diabolik, es un fantasma desde que en 1993 se esfum tras unas vacaciones en Forte dei Marmi (Toscana) cuando ya pesaban sobre l acusaciones y condenas por delitos de asociacin mafiosa, atentados, robos, tenencia de explosivos o una cincuentena de homicidios. Incluido el de un nio de 13 aos, hijo de un mafioso, al que disolvieron en cido ntrico tras un secuestro de 779 das para evitar que su padre colaborarse con la justicia. Hoy vive completamente sumergido y tiene una hija nacida en 1996 a la que jams ha visitado y que ha preferido alejarse de su familia en Castelvetrano. En el pueblo, donde el capo ha dado rdenes de que no se extorsione a comerciantes, nadie osa pronunciar todava las tres palabras que articulan su nombre en voz alta. Es mejor un gesto, mirar al cielo, bajar la voz. Aunque casi nadie sepa ya qu aspecto tiene hoy realmente.El retrato robot de Messina Denaro est hecho de objetos olvidados en zulos, fantasas sobre una posible ciruga facial en clnicas brasileas y viejos testimonios que le acompaaron en sus das de furia, terror y lujo. Tot Riina, su gran padrino corleons (fallecido en un hospital penitenciario en 2017), siempre vio en l al ms listo de sus ahijados, pero le afeaba desde la crcel que se ocupase ms de sus negocios que de la Cosa Nostra. Siempre fue un verso libre, nunca quiso enredarse en los asuntos de otros. Uno de los investigadores que lo sigue desde hace aos retrata as al personaje. Es alguien ledo, le gusta la literatura clsica. Le gusta el latn y el griego. Pero tambin los videojuegos [en una de las redadas se encontr una PlayStation a travs de la que tambin se comunicaba con sus colaboradores]. Fuma cigarrillos Merit, le gusta el perfume, la ropa cara y los automviles de alta gama. Posee inclinaciones liberales anarquistas y ningn inters en gobernar la organizacin, como s lo tuvieron Giovanni Brusca [el hombre que puls el detonador de la bomba que mat en 1992 al juez Giovanni Falcone] o Bernardo Provenzano [jefe de la Cosa Nostra desde 1995 hasta 2006, cuando fue detenido tras 43 aos fugado], apunta esta fuente.La captura de Messina Denaro, que sufra estrabismo y segn el rastro de la investigacin estuvo en Barcelona en 1994 para operarse en la clnica Barraquer, es hoy la gran obsesin del Estado italiano. La polica no ha vuelto a verle desde 1988, cuando fue interrogado como testigo en la comisara de Castelvetrano y asegur que era un simple agricultor. Les dijo que se diverta con su trabajo, que no tena nada que ver con la mafia. Fue la ltima vez que la polica tuvo contacto con l. No hay fotos, huellas dactilares, no se conoce el timbre de su voz, seala el periodista Lirio Abbate, que acaba de publicar USiccu, un libro que arranca con aquella declaracin y que profundiza en las relaciones de inters mutuo que mantuvo durante aos con hombres del Estado. Sin ellos, ninguna fuga hubiera durado tanto.No hay fotos, huellas dactilares, no se conoce el timbre de su vozLirio Abbate, periodistaLa polica detiene regularmente a empresarios, polticos o magistrados acusados de formar parte de su red delictiva casi tres dcadas despus de su desaparicin. Giuseppe Grigoli, considerado el rey de los supermercados en Sicilia, fue detenido en 2013 por sus vnculos con el capo. Le confiscaron 12 empresas y 700 millones de euros que conducan al jefe mafioso. Pero los intereses de Messina Denaro abarcan tambin el sector inmobiliario en el norte de Italia, la energa elica en toda la isla y las apuestas online. El diablico entramado societario, una centrifugadora industrial de capitales, jams permite localizarle. Los arrestos del clan son callejones sin salida, por eso fue tan importante el testimonio de Cimarosa. El da que cojan a Messina Denaro tampoco dir ni una sola palabra. Trapani y Agrigento son zonas muy duras. No son como Palermo, donde detienes a un mafioso y al cabo de poco tiempo hay dos arrepentidos que cantan. All no, explica un magistrado palermitano.El gran capo es hoy la ballena blanca, el Moby Dick de la novela de Herman Melville que a veces emerge a la superficie para coger aire y a la que en 27 aos nadie ha sido capaz de clavar el arpn. Cada cierto tiempo el Estado confa la misin a un nuevo capitn Ahab, que generalmente termina exhausto y se jubila o es trasladado a otro departamento sin la cabeza del capo. La ltima planta de una mole de hormign y cristal en las afueras de Roma esconde el despacho de la persona que ms horas dedica al da a la persecucin del fugitivo. Prohbe revelar su identidad ni el cargo. Viste un traje de rayas azules y grises y no permite grabar la conversacin. Al empezar la entrevista, descarta la posibilidad de enfrentarse a un muerto. Claro que est vivo. No hay nada que nos haga pensar lo contrario. Se habr puesto enfermo y se habr tratado, por supuesto. Como lo hizo Provenzano, que se fue dos veces a la Costa Azul a curarse un cncer. No con su nombre, claro.El elefante en el saln de la Cosa NostraSalvatore Tot Riina, el ltimo gran capo dei capi de la organizacin, el hombre que dise el periodo de los atentados contra el Estado italiano y abri la guerra interna que dej unos 1.700 muertos y el xodo de varias familias a EE UU en los aos ochenta, muri el 17 de noviembre de 2017. La Cosa Nostra intent reorganizarse, volvieron algunos exponentes del otro lado del Atlntico y salieron en libertad viejos jefes encarcelados. En diciembre de 2018 se celebr una reunin para replantear la cpula de la organizacin y proclamaron nuevo capo al viejo Settimo Mineo (80 aos). Pero la polica intercept la reunin y le detuvo a l y a 56 personas ms. Ni siquiera ah estaba Messina Denaro, que nunca tuvo ningn inters en ponerse al frente de la organizacin pese a gozar del prestigio y el respeto para hacerlo.Messina Denaro es hoy tambin un elefante en el saln de la Cosa Nostra. Su magnetismo meditico atrae peligrosamente los focos, pero jams le han dejado caer. Uno de los fiscales que lleva ms aos investigndole aporta los motivos de esa fidelidad en su despacho en Palermo. Cualquier empresa le habra despedido: representa un problema, atrae los focos. Es la gran diferencia entre esta organizacin y el resto del mundo: es un lazo de sangre. Su familia sabe que est permanentemente vigilada, los hermanos han sido arrestados, el resto vive en un Gran Hermano las 24 horas del da. Qu hara usted? Yo lo entregara. Estupendo, ya est bien, aqu lo tenis, dejadnos en paz y que las nuevas generaciones crezcan tranquilas. Pero en realidad es el Estado el que sufre en esta tensin. Es la gran diferencia cultural. No es dinero ni poder, es la fuerza de un vnculo formado en un pacto de honor que se retrotrae a los Badalamenti, a los Busceta, a los Riina.Los Messina Denaro fueron los guardeses durante aos de la familia DAl, propietarios de la Banca Sicula (Antonio, uno de los hijos, fue tambin senador de Forza Italia y secretario de Estado del Ministerio del Interior). Hoy el capo es el ltimo eslabn en libertad de una organizacin que sembr el caos en Italia y desafi al Estado con una tormenta de plomo y sangre jams vista. Los Corleoneses se fiaron de l para poner a salvo gran parte de la fortuna amasada. Tambin para custodiar los secretos ms preciados del archivo de Riina sobre la promiscuidad con los Gobiernos y las famosas negociaciones. En su viaje al final de la noche tuvo la proteccin de decenas de hombres del Estado y sufri todo tipo de vicisitudes. Incluso un cambio de moneda poco favorable en enero de 2002. Perdi mucho dinero con el paso de la lira al euro, explica uno de los carabinieri que se ocupa de este caso en Trapani. Pero sobrevivi.El fiscal general antimafia, Federico Cafiero de Raho, no oculta ya que la caza de Messina Denaro es una prioridad para Italia. Una fuga de 27 aos solo puede interpretarse como un fracaso. Un Estado que puede arrestar a un fugitivo as es un Estado fiable. Y lo estamos dando todo. De vez en cuando nos acercamos, ha sucedido muchas veces. Sin embargo, es como si el sujeto consiguiese percibir la investigacin por su experiencia. Pero un fugitivo como l, que sigue desempeando un rol de alto nivel en la organizacin, tiene por fuerza que estar en el territorio de vez en cuando. Sabemos con certeza que no vive habitualmente cerca de su casa, pero vuelve. Un capo que no lo hace no puede ser un capo. Siempre ha sido as.Tiene la capacidad de ser invisibleEl magistrado confa en resolver uno de los casos ms difciles a los que ha hecho frente la justicia italiana. ""Messina Denaro tiene una gran capacidad de hacerse invisible"", apunta.Don Ciccio, el padre de Matteo Messina Denaro, apareci muerto el 30 de noviembre de 1998 en un bosque de Castelvetrano. Despus de ocho aos fugado, falleci a causa de un infarto, un privilegio para los de su estirpe en aquellos tiempos. Su hijo viva ya entonces escondido con l. Le adoraba. Decidi vestirlo de punta en blanco y abandonar su cadver impoluto para que la polica lo recogiese. Una forma de respeto y la nica manera de que la familia pudiese honrarlo y celebrar un funeral. Pero tambin la ltima burla al Estado y a su incapacidad para encontrarle durante todo aquel tiempo. Cada ao, Il Giornale di Sicilia publica puntualmente una esquela que siempre termina con la firma: I tuoi cari [tus seres queridos]. Nadie duda de quin la encarga. Al principio eran ms largas, citaba a los poetas y filsofos griegos que adora. Hoy sigue pagndola anualmente, pero se han vuelto ms sencillas y escuetas. Dicen en los despachos que es porque el cerco aprieta. Pero es la misma cancin desde hace casi tres dcadas.",La ballena blanca de la Cosa Nostra,https://elpais.com/internacional/2020-08-01/la-ballena-blanca-de-la-cosa-nostra.html

"Iker Casillas parece condenado a despedirse de sus equipos de manera diferente a cmo le hubiera gustado. Como si la vida se encargara de decidir por l cundo y cmo afrontar una nueva etapa. Cuando se march del Real Madrid dijo adis entre lgrimas, rodeado de periodistas pero sin contar con los directivos del club en el que haba jugado desde los 9 aos. Mucho tiempo despus declar que su decisin obedeci a que necesitaba volver a sentirse otro, abandonar estar tan expuesto a la crtica y mejorar. Su relacin con Sara Carbonero, entonces periodista deportiva para una cadena de televisin, los comentarios de los aficionados sobre si favoreca o no a su rendimiento en el terreno de juego, a su entendimiento con el entrenador del equipo e incluso habladuras de que sus conversaciones con ella podan estar tras informaciones sobre lo que ocurra en el vestuario del Real Madrid, pudo con una capacidad de aguante que se haba mostrado templada frente a la portera.Aquella rueda de prensa en solitario fue un error, como l mismo reconoci, pero el merecido homenaje de una aficin que en muchos momentos le calific como el ngel de la guarda del club y de la Seleccin Espaola de Ftbol, se qued en un tibio reconocimiento que no estaba a la altura de su carrera como guardameta de ambos equipos. El consuelo lleg de la mano de la nueva vida que comenz en Oporto, la ciudad a la que se traslad junto a su familia para jugar en el Porto FC. Implic la renuncia de Carbonero a sus apariciones diarias en televisin, pero report a la pareja la paz y el cario que parecan estar pidiendo a gritos.         View this post on Instagram           Lo importante es el camino que recorres y la gente que te acompaa, no el destino al que te lleva, porque eso con trabajo y esfuerzo, llega solo y creo que puedo decir, sin dudar, que ha sido el camino y el destino soado #Grac1as A post shared by  Iker Casillas (@ikercasillas) on Aug 4, 2020 at 4:04am PDT
Su casa frente al mar en la ciudad portuguesa que les acogi como si se tratara de vecinos de toda la vida sirvi de blsamo para las heridas y las dudas que pudieron existir en algn momento. La llegada del segundo hijo de la pareja, Lucas, que naci en 2016 y se uni a Martn, que ahora tiene seis aos, sirvi tambin como cemento de una relacin que transcurra apacible con Casillas reconocido en su nuevo equipo y Carbonero dedicada a la firma de moda, Slow love, que cre junto a su compaera y amiga Isabel Jimnez, a su rentable actividad en el mundo de la publicidad y de las prescriptoras de tendencias. En febrero de 2019 dio por finalizada la excedencia que haba pedido en Mediaset y anunci su regreso a Deportes Cuatro, del mismo grupo televisivo para ponerse al frente de una seccin semanal en la que comenz a entrevistar a los protagonistas del mundo del deporte. En marzo Casillas, que entonces tena 37 aos, renovaba por una temporada con opcin a otra ms en el equipo luso.Todo pareca encaminado de nuevo para los dos hasta el 2 de mayo del mismo ao Iker Casillas sufra un infarto de miocardio agudo mientras entrenaba. Dos semanas despus, con el deportista recin dado de alta, Sara Carbonero anunci en en su perfil de Instagram que haba sido operada de un tumor maligno de ovario y que todava quedaban meses de tratamiento por delante. Otra vez la vida se encarg de desbaratar los planes de uno y otro, y otra vez Casillas supo que no se despedira del ftbol jugando un partido. El anuncio de este martes es solo la confirmacin de lo que ya se saba por los propios movimientos que el jugador ha ido realizando en los ltimos meses, cuando la salud di a ambos un respiro, y l anunci que se presentara a las elecciones para la Federacin Espaola de Ftbol, un objetivo al que renunci solo cuatro meses despus.         View this post on Instagram             . #enremojo #tb #Algarveando #calma #unveranomuyverano #buenasnoches #slowlife A post shared by  Sara Carbonero (@saracarbonero) on Aug 3, 2020 at 1:47pm PDT
Hola a todos. Hoy es uno de los das ms importantes y, a la vez difciles, de mi vida deportiva: ha llegado el momento de decir adis, es el comienzo de la carta que hizo pblica el portero este martes y marca el comienzo de su nueva vida. En ella, adems de repasar algunos de sus logros deportivos, no se ha olvidado de todos los que me habis acompaado en este viaje. De su familia, por los sacrificios que hicisteis, y directamente de su mujer y sus hijos: A mi mujer y a mis hijos, Martn y Lucas, gracias por todo vuestro apoyo, por todas esas horas que no he podido pasar a vuestro lado en este ltimo trayecto de mi vida deportiva. Gracias por comprenderme y animarme a disfrutar de esta vida que eleg. Sin duda a vuestro lado todo es ms fcil.Durante el verano la pareja volver a los pueblos que les son tan familiares, Navalacruz y Corral de Almaguer, y despus desvelarn si Oporto les ha conquistado como para quedarse algo ms o si su nueva vida pasa por su regreso a Madrid, a la casa que poseen en la exclusiva urbanizacin de La Finca. Lo que es seguro es que la vida cambi para siempre para ellos durante su estancia en Oporto, que l quiere seguir ligado al ftbol y ella al periodismo y la moda, pero que los zarandeos que ha sufrido su salud ha cambiado el orden de sus prioridades y ni un homenaje ni un programa de televisin por hacer sern capaces de quitarles el sueo.",Iker Casillas y Sara Carbonero frente al comienzo de una nueva etapa en su vida,https://elpais.com/gente/2020-08-04/iker-casillas-y-sara-carbonero-frente-al-comienzo-de-una-nueva-etapa-en-su-vida.html

"El presidente del Gobierno, Pedro Snchez, ha comparecido este martes en La Moncloa tras el Consejo de Ministros para hacer balance de los ltimos seis meses del Ejecutivo. En la rueda de prensa, la decisin del rey emrito de abandonar Espaa y las divisiones que ha generado entre los socios de Gobierno ha acaparado las preguntas, pero antes y durante casi 40 minutos, el jefe del Ejecutivo ha aprovechado para defender su gestin durante la crisis del coronavirus, sin hacer autocrtica, y advertir a sus rivales, como ya hizo la semana pasada en el Congreso, que la legislatura ser larga. Al tiempo, rest importancia a las diferencias entre los partidos que ocupan La Moncloa: Estoy muy orgulloso de cada uno de los ministros, seal.Snchez advirti que vienen meses muy duros y urgi a los partidos polticos a arrimar el hombro en una situacin crtica durante la negociacin de los Presupuestos Generales del Estado siguen gobernando con los aprobados por el ltimo Ejecutivo de Mariano Rajoy, de 2018. Apelo al espritu de comunidad para todo lo que tenemos por delante, declar el presidente del Gobierno. Cuando se trata del inters nacional, aqu no hay lmite de aforo; todos son bienvenidos, aadi, pese a que Podemos y ERC, socio de coalicin y apoyo en la investidura, respectivamente, no ven con buenos ojos que el rea socialista del Gobierno negocie con Ciudadanos. Snchez explic que las lneas maestras de los Presupuestos sern los compromisos firmados en el pacto de legislatura con Unidas Podemos y ha puesto de ejemplo el acuerdo en la Unin Europea entre Gobiernos con orientaciones polticas enfrentadas como ejemplo de que es posible un acuerdo con otras formaciones polticas. No tiro la toalla, zanj. El PSOE y Podemos suman 155 escaos. Para aprobar unas nuevas cuentas necesitan 21 ms.El presidente ha establecido un calendario para la ejecucin del pacto del Gobierno de coalicin, una combinacin de los programas electorales del PSOE y Unidas Podemos. Pas de puntillas por lo referido a la reforma laboral, que ambos partidos se comprometieron a derogar, y que ya ha provocado fricciones en el seno del Ejecutivo. Dilogo social, dilogo social y dilogo social. Es la legislatura del dilogo social, y despus de la pandemia, ms, se limit a decir. La patronal se opone a una derogacin total de la norma. El PSOE y Podemos firmaron el pasado mayo un acuerdo con Bildu para derogar la norma del Ejecutivo de Rajoy, pero los socialistas lo matizaron esa misma noche y los vicepresidentes Iglesias y Nadia Calvio, titular de Economa, expusieron pblicamente sus diferencias sobre el momento y la extensin de la revisin de la ley.Snchez record que el pacto con Podemos contena 428 compromisos y asegur que ms del 55% se ha activado ya. Aadi que en un ao habrn ejecutado casi una quinta parte de los acuerdos y admiti que un 10% no especific qu abarcaba necesitar ms tiempo para una ejecucin ntegra. El presidente tambin explic que la reforma fiscal se aplazar hasta que se recuperen los niveles de crecimiento previos a la pandemia. El pacto con Podemos prevea un tipo mnimo del 15% en el impuesto de Sociedades, un 18% para la banca, el aumento del IRPF de las rentas altas, una subida del 1% en Patrimonio a fortunas de ms de 10 millones o la creacin de la llamada tasa Tobin y la tasa Google.El presidente tambin se refiri, entre otros proyectos, a la nueva ley de memoria democrtica, que corrige las deficiencias de la ley de memoria histrica aprobada por el Gobierno de Jos Luis Rodrguez Zapatero en 2007, y cuyas principales novedades avanz EL PAS el pasado julio.",El Gobierno pospone la reforma fiscal hasta recuperar el nivel de crecimiento previo a la epidemia,https://elpais.com/espana/2020-08-04/el-gobierno-pospone-la-reforma-fiscal-hasta-recuperar-el-nivel-de-crecimiento-previo-a-la-epidemia.html

"Tras seis das ardiendo, el incendio de Cualedro (Ourense) ha sido extinguido este martes. Se trata del mayor fuego registrado en Galicia desde 2017, cuando se produjo una inslita ola incendiaria en pleno otoo. Las llamas han calcinado, segn los datos de la Xunta, 1.535 hectreas de superficie en Cualedro. Comenzaron el pasado mircoles y no fueron controladas hasta el sbado.Del terreno arrasado por el fuego de Cualedro 525 hectreas son agrcolas y 1.010 forestales (unas 960 rasas y unas 50 arboladas). Para lograr apagar este incendio fue movilizada la Unidad Militar de Emergencias (UME), que trabaj codo a codo con un equipo de extincin formado por dos tcnicos, 54 agentes, 132 brigadas, 51 motobombas, seis palas, 13 helicpteros y 13 aviones.El Gobierno gallego sostiene que este incendio ha sido intencionado porque empez el mircoles al medioda en la parroquia de San Millao en al menos dos puntos diferentes simultneos. Su evolucin lleg a obligar a activar el nivel de alerta 2 por su cercana a viviendas.Mientras se extinguen las llamas en Cualedro, el fuego sigue golpeando la provincia de Ourense. Un incendio forestal afecta este martes al municipio de Viana do Bolo y, segn informa la Xunta, ha afectado ya a unas 40 hectreas.",Extinguido el mayor incendio en Galicia desde 2017 tras arder durante seis das,https://elpais.com/espana/2020-08-04/extinguido-el-mayor-incendio-en-galicia-desde-2017-tras-arder-durante-seis-dias.html

