body,title"Vuelta de tuerca a la estrategia de Cataluña para contener el coronavirus. Tras la detección de un nuevo foco en la comarca barcelonesa del Vallès, donde la incidencia se ha duplicado en la última semana, la comunidad ha optado por salir a buscar activamente el virus: el Departamento de Salud desplegará un cribado masivo de la covid-19 entre unas 9.000 personas de tres municipios de la zona para atajar la transmisión. Este muestreo poblacional al estilo asiático se realizará en varios vecindarios de Terrassa, Sabadell y Ripollet donde hay más presencia de la covid-19. Sería el primero de este tipo en España.El Govern contabiliza más de 100.000 casos de covid-19 y pone el foco en el VallèsTrece comarcas catalanas están en riesgo alto de rebrote“No pongas en peligro ni tu vida, ni la de tus vecinos” Salud instalará carpas para realizar pruebas PCR a 4.000 vecinos de Sabadell (aunque el Ayuntamiento ha dicho que serán 3.000) y otros 3.000 de Terrassa durante tres días a partir del jueves. En Ripollet, donde la zona afectada está más acotada, Salud Pública también irá puerta a puerta de viviendas y comercios para realizar otras 2.000 PRC desde este miércoles. “Queremos adelantarnos a que haya transmisión comunitaria”, ha dicho este martes el secretario de Salud Pública, Josep Maria Argimon.No es la primera vez que se instalan carpas en un municipio para hacer PCR masivas. En la localidad vasca de Ordizia se hizo un llamamiento a los vecinos que habían estado de copas por unos locales de la calle Etxezarreta. En Córdoba, se testó a más de un millar de personas (la mayoría en un espacio autocovid, donde la prueba se realiza en coche sin salir del vehículo) vinculadas con una fiesta en una discoteca. Pero, hasta ahora, siempre que se ha desplegado esta estrategia ha sido a colectivos determinados. En empresas hortofrutícolas de la comarca leridana del Segrià o en brotes laborales circunscritos a una compañía también se han hecho test masivos a los empleados.En el caso de los municipios del Vallès, no obstante, las PCR están abiertas de forma indiscriminada a todos los vecinos de los vecindarios afectados, y recuerdan a los test por barrios realizados en canchas deportivas a todos los vecinos de ciertos distritos de Pekín. Los tres municipios catalanes tienen una tasa de reproducción del virus (R) por encima de 1, lo que significa que, de media, un caso infectado contagia a más de una persona. Los expertos recomiendan que la R esté siempre por debajo de la unidad para contener el virus.Los casos registrados en Sabadell en la última semana (154, entre el 25 y el 31 de julio) casi se han cuadruplicado respecto a los detectados dos semanas atrás. “Cuando tienes un paciente que no sabe dónde lo ha cogido, significa que ya hay transmisión comunitaria. Aquí nos ha pasado poco, pero tenemos miedo a que esto empiece a ocurrir”, explica Manel Cervantes, director del servicio de Enfermedades Infecciosas del Parc Taulí de Sabadell. El hospital tiene 16 personas con covid-19 ingresadas, aunque ninguna en cuidados intensivos.Estrategia combinadaTerrassa, por su parte, ha registrado los últimos días de julio 115 nuevas infecciones y cinco hospitalizados, dos de ellos en cuidados intensivos. Allí también se instalarán un par de carpas que, según el Consistorio, estarán instaladas cerca de los centros de salud Rambla, Norte y Este. “Pondremos unidades de asistencia móvil del Sistema de Emergencias Médicas en zonas de paso, en entornos comunitarios”, ha indicado Argimon.La situación de Ripollet, que ha reportado 22 casos y tres ingresos en la última semana, es diferente a la de Terrassa y Sabadell. En su caso, Salud tiene más acotada la zona donde se ubican el grueso de los contagios y realizará también una intervención puerta a puerta, con mediadores y agentes cívicos de refuerzo. Un antecedente de esta estrategia se realizó en el municipio de Granollers, aunque en pequeñas dimensiones (266 PCR hechas).Los expertos coinciden en que el cribado masivo con PCR puede ser efectivo en los municipios del Vallès, pero descartan desplegarlo de forma generalizada. “Esto ya lo habían hecho en Corea del Sur. No es una buena estrategia para aplicarla de forma indiscriminada, solo en zonas donde se detecta un aumento en un momento determinado. La PCR es una foto del momento y cuando hay un acúmulo de casos es una opción”, apunta Cervantes. Coincide Jesús Molina Cabrillana, portavoz de la Sociedad Española de Medicina Preventiva, Salud Pública e Higiene: “Esta medida está bien para conocer y tener más información y más detallada de lo que está pasando. Pero la PCR no es una prueba de cribado, solo aplicada en un contexto epidemiológico concreto tiene utilidad. En este caso, como la incidencia va en aumento, tienen más probabilidades de encontrar casos asintomáticos”.Según Cervantes, la experiencia de los últimos días refleja que el nivel de transmisión es alto. “No es muy científico, pero a partir del estudio de contactos, nos salen entre dos o tres familiares por caso, lo que significa que la R es mayor de 2 y esto no está todavía controlado. Por ahora es gente sana, sin síntomas. Si no llega a los abuelos, no nos veremos como en marzo o abril”, valora.Cabrillana apunta que esta estrategia permitirá tomar mejores decisiones. “Esto les dará más pistas de lo que está ocurriendo y caracterizar más a la población para tomar nuevas decisiones”. De hecho, insiste en que la PCR tiene que ir acompañada de otro paquete de medidas: “El cribado per se no va a servir de mucho si no va acompañado del aislamiento de los casos, la detección temprana y medidas de prevención”. Argimon, que ya restringió el ocio nocturno en la comunidad, no descarta nuevas medidas según los resultados del cribado.Regar plazas para evitar concentraciones“Los casos en Sabadell están creciendo. La situación no es para generar alarma, pero hay que actuar”, ha valorado la alcaldesa de Sabadell, Marta Farrés. La regidora explicó que las dos carpas se instalarán en la zona sur de la ciudad: una de ellas, en la plaza de las Termas y otra, en la plaza Picasso del barrio Campoamor, una zona humilde muy castigada por la covid-19. La alcaldesa señaló que, aunque en la zona norte de la ciudad también se ha registrado un aumento de casos, “en esa zona es más fácil seguir la trazabilidad de los contactos” de los casos positivos.

Por su parte, el alcalde de Terrassa, Jordi Ballart, ha llamado a “recuperar la responsabilidad y no relajarse”. Además de las carpas que se instalarán cerca de los centros de salud de los barrios donde se han detectado más casos, el Consistorio anunció que, durante las próximas noches y como medida disuasoria, se regarán plazas y espacios de la ciudad para evitar la concentración de personas, mientras que las terrazas de bares y restaurantes deberán cerrar a medianoche los fines de semana.Información sobre el coronavirus- Aquí puede seguir la última hora sobre la evolución de la pandemia- Así evoluciona la curva del coronavirus en España y en cada autonomía- Buscador: La nueva normalidad por municipios- Preguntas y respuestas sobre el coronavirus- Guía de actuación ante la enfermedad",Cataluña hará test masivos en tres ciudades para contener el virus
"Si imaginamos a dos personas teniendo sexo, por norma general, pensamos en una pareja heterosexual, joven y más bien atractiva. Lo que viene siendo la típica escena estereotipada de película o la imagen que la publicidad nos vende del sexo. Pero por mucho que nos empeñemos en ocultarlo, casi todo el mundo guarda una vida erótica (con excepción de los asexuales). Y esa totalidad abarca a mayores de 70, incluso a los octogenarios, que viven su experiencia de cama con igual pasión que el resto. Un tabú hecho añicosLo cuentan públicamente y sin ningún tipo vergüenza personas muy conocidas, como María Teresa Campos o Manuela Carmena, que respondieron a la famosa pregunta sobre sexo en el programa La resistencia con toda naturalidad. La exjueza dijo que sus 75 años son “una época enorme para la imaginación y la creatividad” entre las sábanas. Mientras que la periodista, de 78, no ocultó su querencia por la exploración en solitario. La buena salud de los baby boomers (nacidos entre 1946 y 1964) es un factor determinante en esta nueva estampa. En la época de la obsesión por el running, los gimnasios y las dietas verdes, el descenso de los achaques entre los mayores de 60 es evidente. Y los estudios sostienen que esa óptima condición física es directamente proporcional a la gloria social de la que gozan. ¿Significa esto que todas las generaciones tendrán siempre una mejor vida sexual que sus antecesoras? Tal como dijo Carmena: “Hay esperanza”.Hasta las residencias se montan un TinderSegún datos del informe Perspectivas de la población mundial 2019, en 2050 una de cada seis personas en el mundo tendrá más de 65 años (16%); frente a la proporción de una de cada 11 de 2019 (9%).Este escenario plantea un desafío para los gerontólogos: ya no basta con vivir más años, sino que se aspira a que estos cada vez sean mejores. Y aquí la sexualidad también tiene algo que decir: los estudios han empezado a incluir su valoración como un índice favorable de calidad de vida, incluso cuando hay enfermedades crónicas asociadas a la edad. Sexo oral, la asignatura sexual pendiente de los hombres que las mujeres deben enseñarEn tiempos de coronavirus, ¿qué temas se sacan en una primera cita?Es pues la pescadilla que se muerde la cola: sentirse bien incita al sexo, pero tenerlo es una inversión en bienestar. Según la sexóloga Ximena González “existen investigaciones que señalan que las relaciones sexuales reducen la carga de las enfermedades durante la vejez, puesto que la hormona sexual femenina que se produce durante el orgasmo parece promover la salud de las mujeres mayores”. No solo eso: la experta añade que “otra de las ventajas de seguir manteniendo relaciones sexuales durante este ciclo de la vida es la salud emocional, puesto que la intimidad o la cercanía con la pareja permiten expresar sentimientos, a través de caricias, besos, abrazos o sonrisas, ayudando así a reducir el estrés”. Tanto es así que hay residencias de ancianos en las que ya trabajan por recordar la importancia de la salud sexual entre sus inquilinos. Este es el caso de Hebrew Home Riverdale, en el Bronx, Nueva York (EE UU), que saltó a los titulares de la prensa de medio mundo gracias a sus programas para ayudar a los residentes a buscar relaciones sexuales, con la creación de bailes sociales, como los del instituto, o programas de citas, al más puro estilo Tinder. Pero no será un camino de rosasReducción de líquido seminal, respuesta a la excitación más lenta, erección no tan firme, orgasmos más leves, sequedad vaginal o una necesidad de más tiempo para recuperarse, son algunos de los cambios fisiológicos que trae consigo el envejecimiento y afectan a la sexualidad, según la Biblioteca de Salud de Sanitas. “Hay que asumir la barrera física que supone el desgaste del organismo con la edad. Pero estas limitaciones no tienen por qué aparecer en todas las personas”, matiza Silvia Romero, médica y sexóloga. Asimismo, si la penetración no es posible, las expertas recomiendan no frustrarse, pues el sexo implica otros muchos caminos por descubrir, relacionados con tocamientos, palabras y zonas olvidadas del cuerpo.Otras veces el problema no será físico, sino mental. Por ello, Romero recuerda que para mantener relaciones sexuales no necesitamos ser atletas, ni modelos. “Simplemente, deberíamos permitirnos ser nosotros mismos: sentir, estar abiertos al placer y potenciar el poder de nuestra imaginación, solos o en compañía”. Las relaciones sexuales reducen la carga de enfermedades en la vejez y mejoran la salud emocional. Y no pidas peras al olmo: es posible que el cuerpo no aguante todo tipo de posturas y sobresaltos. En Inforesidencias.com, el buscador de hogares para la tercera edad, despliegan pautas de sentido común: “Si uno de los dos tiene problemas de columna, que no cargue con el peso del otro. Y, si hay dolor de rodillas, evítese la genuflexión”. Otro consejo práctico de la misma fuente: no tengas inconveniente en ensayar cualquier postura de cama antes de llevarla a cabo, “para asegurarte de que sea realmente cómoda”. Todo será más sencillo “si se mantienen hábitos de vida saludables, como evitar el consumo de tóxicos, seguir una buena dieta y hacer ejercicio, que ayuda a mantener a raya el colesterol, mejora la circulación de la sangre y la movilidad de las articulaciones”, recomienda Silvia Romero. Ximena González, por su parte, subraya que no está de más comentar cualquier duda de sexualidad con tu médico de cabecera, “sobre todo las relacionadas con riesgo de infarto o problemas cardiovasculares”. Y, para quienes ya sean pacientes cardiacos, esto tampoco ha acabado: “El gasto energético de un coito es similar al que genera subir dos pisos de escaleras. Y la frecuencia cardiaca durante el mismo, parecida al de muchas actividades cotidianas. Por tanto, ya que su esfuerzo físico es moderado, no traería ninguna complicación retomar el sexo después de un infarto, siempre que lo consulte con el especialista”, zanjan desde la Fundación Española del Corazón. ","El sexo entre abuelos: distinto, pero magnífico "
"The End of the F***ing World (Netflix) es una espléndida e inquietante serie británica sobre un intenso viaje iniciático de dos jóvenes de 17 años, James y Alyssa. Él se define como un piscópata y ella odia a todo el mundo. Dos almas complementarias de ese enigmático mundo de la adolescencia del que apenas nadie sabe nada y del que ellos ni siquiera se plantean conocerlo. Actúan instintivamente sin necesidad de justificar sus actos. Son y hacen, es todo....Inicia sesión para seguir leyendoSólo con tener una cuenta ya puedes leer este artículo, es gratisRegístrateIniciar SesiónGracias por leer EL PAÍS",Una inquietante serie británica
"Macho de Estrellita Ecuatoriana llegando a una percha de Chuquiraga.Jorge Castillo Castro“Entender el cerebro de los animales es entendernos a nosotros”. Fernanda G. Duque, investigadora del Instituto de Neurociencia de la Universidad Estatal de Georgia, en Estados Unidos, está convencida de ello y asegura que las aves se comunican de la misma manera que el ser humano. En un estudio reciente publicado en Current Biology, la experta ha demostrado que una especie de colibrí llamada Estrellita Ecuatoriana (Oreotrochilus chimborazo) es capaz de cantar a frecuencias más altas de lo esperado, es decir, a más de 13,4 kilohercios. Hasta ahora, se pensaba que los pájaros no superaban los 8. “Esto ha retado nuestro conocimiento. Durante mucho tiempo, pensamos que los mamíferos tenían un rango auditivo más amplio por tener una cóclea más larga. Este estudio nos hace repensar en las otras formas que tiene el cerebro para adaptarse a los retos en su ambiente y generar una respuesta”, explica. La acústica en el mundo animal es muy amplia y esencial para la supervivencia, tanto para cazar, proteger su hábitat y criar como para reproducirse.Existen unas cinco especies de colibríes capaces de generar altas frecuencias y es posible que no sean las únicas. Un aspecto curioso del estudio es que algunos de estos sonidos, destinados en parte a atraer a una pareja, no llegan al oído de otros pájaros ni al del ser humano. Las hembras son la clave del sistema: deciden con qué macho quieren aparearse en función de su canto. Cuanto más alto y largo, mejor. Estas melodías son más fáciles de escuchar e indica que el macho se está esforzando más, que tiene más energía y mejor salud porque puede hacer ese esfuerzo adicional. Además, los pájaros saben reconocer las notas y su calidad. Tienen una percepción auditiva mucho más precisa que el ser humano, según afirma la autora del estudio. Un aspecto que sería interesante analizar no es cómo producen sonido, sino más bien cómo lo escuchan.Uno de los aspectos que más apasiona a Duque es la diversidad de sonidos y cantos que existen en el mundo de las aves. La hembra recibe una multitud de señales que sería interesante analizar, pues supone un reto a la hora de elegir pareja. “Los pájaros tienen un repertorio muy elaborado y complejo, pero siempre se ha investigado a los machos pensando que ellas son pasivas, pero en realidad son las que deciden y es importante ver cómo lo hacen y de qué depende”, insiste.Los pájaros saben reconocer las notas y su calidad. Tienen una percepción auditiva mucho más precisa que el ser humano¿Cabe la posibilidad de que un macho que no sepa cantar se quede sin pareja? La respuesta es sí, pero algunos quizás tengan alguna oportunidad de encontrar su media naranja en función de la época reproductiva, pues la exigencia de las hembras varía. Si todavía no ha logrado tener crías y el final se acerca, la hembra puede ser más tolerante. La soledad de algunos machos también puede deberse a que ayudan al macho dominante a seducir. Los gallitos de las rocas (Rupicola peruvianus), por ejemplo, montan coros y danzas para desplegar un sistema de cortejo elaborado. “Los más jóvenes aprenden y probablemente un día tomen el papel de dominante y consigan aparearse. Pero es verdad que algunos nunca lo lograrán”, asume la experta.Otra vía de investigación para entender mejor la orquesta que anima el cielo, son los duetos en los cuales las hembras también cantan. Ese fenómeno sirve para reforzar el vínculo de la pareja (en caso de que se trate de una ave monógama) y proteger el territorio. “Quedan todavía muchas cosas por descubrir”, dice Duque.En el aire, hay otras especies que también dependen de la calidad de sus sonidos para ganarse a una hembra, así como los saltamontes y los mosquitos. Los resultados de un estudio demostró que tanto el tamaño corporal como la armonía de sus señales sonoras son determinantes del éxito del apareamiento masculino en los mosquitos Aedes aegypti.Del aire a la charcaPara las ranas, las operaciones colectivas para atraer a las hembras son esenciales. Ignacio de la Riva, del Museo Nacional de Ciencias Naturales (MNCN-CSIC), explica que los machos utilizan dos tipos de notas. Las primeras se podrían definir como las agresivas mientras que las otras serían las atractivas. Unas son para proteger el territorio y alejar competidores, y las segundas, para seducir. En los anfibios, el criterio de selección es parecido al de las aves. Cuanto más potente sea el canto y con mayor cantidad de chasquidos, más le gustará a la hembra. “Unas especies tienen un saco vocal enorme para amplificar el sonido y otras, estructuras dobles”, describe el experto en anfibios.Bajo su punto de vista, es muy interesante estudiar las vocalizaciones de estos animales, ya que están diseñados para evitar cruces de especies erróneos, como un mecanismo de aislamiento. ”Para un taxónomo que intenta describir especies es útil ver las diferencias de parámetro de canto porque son bastante fijas y permiten distinguirlas”, explica. El experto pide que se destruya el mito de que las ranas solo hacen croac, pues la variedad de sonidos es inmensa. “Tienen una paleta muy amplía que utilizan en función de sus necesidades y del contexto social. Si hay muchos ejemplares, sus ruidos serán mucho más intensos, por ejemplo”, asevera de la Riva.De la charca al bosqueLos mamíferos son más atractivos cuando son más grandes que sus rivales y lo saben. Por eso, algunos son capaces de fingir un mayor tamaño jugando con las frecuencias graves, según recuerda un estudio recopilatorio publicado en Nature Communications. Juan Carranza, experto en ungulados desde hace más de 20 años y catedrático de la Universidad de Córdoba, explica que con los ciervos pasa algo parecido, pues la potencia de la berrea del macho (que ocurre a mediados de septiembre) revela su calidad. Un estudio demostró que las hembras suelen sentirse atraídas por los machos que berrean durante más tiempo y con más fuerza y son capaces de adelantar su ovulación al escucharlos. Es lo que llaman, según relata Carranza, el “efecto macho”, ya que su presencia induce el celo de la hembra. Para demostrar eso, los investigadores reprodujeron artificialmente el sonido de la berrea y constataron que las hembras que lo escuchaban, ovulaban antes que las que no.Otro grupo de científicos hizo el mismo experimento únicamente con machos. Al difundir una grabación de un sonido de tasa pequeña, los ciervos venían a atacar porque pensaban que se trataba de un rival poco peligroso. En cambio, una berrea fuerte y larga indica que el macho suele ganar peleas. Por lo tanto, si se reproducía un ruido con una tasa alta, los que lo escuchaban se retiraban. Cuenta Carranza que los sonidos permiten entender el comportamiento del ciervo. Cada sonido del animal va asociado a una cosa o a un movimiento. El ciervo produce tres sonidos distintos, uno largo para mostrar su potencia, otra más ronco que sale de la garganta y una especie de ladrido entrecortado para alejar a sus rivales.Un estudio de la Universidad de Cornell (Nueva York, Estados Unidos), basado en datos de nueve años, ha cambiado ideas preconcebidas: los pandas gigantes no son silenciosos. Todo lo contrario. Producen sonidos durante la temporada de reproducción para coordinarse y expresar sus preferencias. Los resultados del trabajo muestran el potencial de las vocalizaciones de las cuales depende su éxito de apareamiento.De la tierra al marEl agua es un medio eficaz para transmitir sonido e informaciones a largas distancias. Los peces también hacen lo que se nombra “llamadas de apareamiento” como se registró en tres especies llamadas Prochilodus argenteus, P. costatus y P. lineatus, según se publicó hace tres años. Por otra parte, una decena de crustáceos son capaces de emitir sonidos. Los cangrejos son un ejemplo curioso. Todavía muy misteriosos en cuanto a su estructura y su anatomía, estos animales también recurren a sonidos bajo el agua a la hora de reproducirse, tanto el macho como la hembra. Frente a todo esto, para Francesco Filiciotto, autor de un estudio sobre la especie Neohelice granulata e investigador del Consejo Nacional de Investigación de Italia, el foco más importante es el impacto que tiene el ser humano sobre estas comunicaciones vitales.“Es el gran problema. El nivel de ruido en el agua ha aumentado unos 50 decibelios en los últimos 30 años”, explica Filiciotto. Sin embargo, los mensajes de los cangrejos, que recorren unos 200 metros, por ejemplo, no suelen superar los seis decibelios. En definitiva, el ser humano contribuye a reducir la comunicación que les permite alimentarse, protegerse y reproducirse. “La contaminación acústica hace que el agua se convierta en un desierto”, concluye el científico. Otra de las especies que más le intrigan son los moluscos que producen sonidos, pero el cómo lo hacen es un misterio todavía.Estos son tan solo algunos ejemplos de animales que utilizan los sonidos como método de seducción para asegurarse una descendencia de la mejor calidad posible. La lista es larga.Puedes seguir a MATERIA en Facebook, Twitter, Instagram o suscribirte aquí a nuestra Newsletter.",Lecciones sonoras de los animales para seducir
