body,title,url
"Macho de Estrellita Ecuatoriana llegando a una percha de Chuquiraga.Jorge Castillo CastroEntender el cerebro de los animales es entendernos a nosotros. Fernanda G. Duque, investigadora del Instituto de Neurociencia de la Universidad Estatal de Georgia, en Estados Unidos, est convencida de ello y asegura que las aves se comunican de la misma manera que el ser humano. En un estudio reciente publicado en Current Biology, la experta ha demostrado que una especie de colibr llamada Estrellita Ecuatoriana (Oreotrochilus chimborazo) es capaz de cantar a frecuencias ms altas de lo esperado, es decir, a ms de 13,4 kilohercios. Hasta ahora, se pensaba que los pjaros no superaban los 8. Esto ha retado nuestro conocimiento. Durante mucho tiempo, pensamos que los mamferos tenan un rango auditivo ms amplio por tener una cclea ms larga. Este estudio nos hace repensar en las otras formas que tiene el cerebro para adaptarse a los retos en su ambiente y generar una respuesta, explica. La acstica en el mundo animal es muy amplia y esencial para la supervivencia, tanto para cazar, proteger su hbitat y criar como para reproducirse.Existen unas cinco especies de colibres capaces de generar altas frecuencias y es posible que no sean las nicas. Un aspecto curioso del estudio es que algunos de estos sonidos, destinados en parte a atraer a una pareja, no llegan al odo de otros pjaros ni al del ser humano. Las hembras son la clave del sistema: deciden con qu macho quieren aparearse en funcin de su canto. Cuanto ms alto y largo, mejor. Estas melodas son ms fciles de escuchar e indica que el macho se est esforzando ms, que tiene ms energa y mejor salud porque puede hacer ese esfuerzo adicional. Adems, los pjaros saben reconocer las notas y su calidad. Tienen una percepcin auditiva mucho ms precisa que el ser humano, segn afirma la autora del estudio. Un aspecto que sera interesante analizar no es cmo producen sonido, sino ms bien cmo lo escuchan.Uno de los aspectos que ms apasiona a Duque es la diversidad de sonidos y cantos que existen en el mundo de las aves. La hembra recibe una multitud de seales que sera interesante analizar, pues supone un reto a la hora de elegir pareja. Los pjaros tienen un repertorio muy elaborado y complejo, pero siempre se ha investigado a los machos pensando que ellas son pasivas, pero en realidad son las que deciden y es importante ver cmo lo hacen y de qu depende, insiste.Los pjaros saben reconocer las notas y su calidad. Tienen una percepcin auditiva mucho ms precisa que el ser humanoCabe la posibilidad de que un macho que no sepa cantar se quede sin pareja? La respuesta es s, pero algunos quizs tengan alguna oportunidad de encontrar su media naranja en funcin de la poca reproductiva, pues la exigencia de las hembras vara. Si todava no ha logrado tener cras y el final se acerca, la hembra puede ser ms tolerante. La soledad de algunos machos tambin puede deberse a que ayudan al macho dominante a seducir. Los gallitos de las rocas (Rupicola peruvianus), por ejemplo, montan coros y danzas para desplegar un sistema de cortejo elaborado. Los ms jvenes aprenden y probablemente un da tomen el papel de dominante y consigan aparearse. Pero es verdad que algunos nunca lo lograrn, asume la experta.Otra va de investigacin para entender mejor la orquesta que anima el cielo, son los duetos en los cuales las hembras tambin cantan. Ese fenmeno sirve para reforzar el vnculo de la pareja (en caso de que se trate de una ave mongama) y proteger el territorio. Quedan todava muchas cosas por descubrir, dice Duque.En el aire, hay otras especies que tambin dependen de la calidad de sus sonidos para ganarse a una hembra, as como los saltamontes y los mosquitos. Los resultados de un estudio demostr que tanto el tamao corporal como la armona de sus seales sonoras son determinantes del xito del apareamiento masculino en los mosquitos Aedes aegypti.Del aire a la charcaPara las ranas, las operaciones colectivas para atraer a las hembras son esenciales. Ignacio de la Riva, del Museo Nacional de Ciencias Naturales (MNCN-CSIC), explica que los machos utilizan dos tipos de notas. Las primeras se podran definir como las agresivas mientras que las otras seran las atractivas. Unas son para proteger el territorio y alejar competidores, y las segundas, para seducir. En los anfibios, el criterio de seleccin es parecido al de las aves. Cuanto ms potente sea el canto y con mayor cantidad de chasquidos, ms le gustar a la hembra. Unas especies tienen un saco vocal enorme para amplificar el sonido y otras, estructuras dobles, describe el experto en anfibios.Bajo su punto de vista, es muy interesante estudiar las vocalizaciones de estos animales, ya que estn diseados para evitar cruces de especies errneos, como un mecanismo de aislamiento. Para un taxnomo que intenta describir especies es til ver las diferencias de parmetro de canto porque son bastante fijas y permiten distinguirlas, explica. El experto pide que se destruya el mito de que las ranas solo hacen croac, pues la variedad de sonidos es inmensa. Tienen una paleta muy ampla que utilizan en funcin de sus necesidades y del contexto social. Si hay muchos ejemplares, sus ruidos sern mucho ms intensos, por ejemplo, asevera de la Riva.De la charca al bosqueLos mamferos son ms atractivos cuando son ms grandes que sus rivales y lo saben. Por eso, algunos son capaces de fingir un mayor tamao jugando con las frecuencias graves, segn recuerda un estudio recopilatorio publicado en Nature Communications. Juan Carranza, experto en ungulados desde hace ms de 20 aos y catedrtico de la Universidad de Crdoba, explica que con los ciervos pasa algo parecido, pues la potencia de la berrea del macho (que ocurre a mediados de septiembre) revela su calidad. Un estudio demostr que las hembras suelen sentirse atradas por los machos que berrean durante ms tiempo y con ms fuerza y son capaces de adelantar su ovulacin al escucharlos. Es lo que llaman, segn relata Carranza, el efecto macho, ya que su presencia induce el celo de la hembra. Para demostrar eso, los investigadores reprodujeron artificialmente el sonido de la berrea y constataron que las hembras que lo escuchaban, ovulaban antes que las que no.Otro grupo de cientficos hizo el mismo experimento nicamente con machos. Al difundir una grabacin de un sonido de tasa pequea, los ciervos venan a atacar porque pensaban que se trataba de un rival poco peligroso. En cambio, una berrea fuerte y larga indica que el macho suele ganar peleas. Por lo tanto, si se reproduca un ruido con una tasa alta, los que lo escuchaban se retiraban. Cuenta Carranza que los sonidos permiten entender el comportamiento del ciervo. Cada sonido del animal va asociado a una cosa o a un movimiento. El ciervo produce tres sonidos distintos, uno largo para mostrar su potencia, otra ms ronco que sale de la garganta y una especie de ladrido entrecortado para alejar a sus rivales.Un estudio de la Universidad de Cornell (Nueva York, Estados Unidos), basado en datos de nueve aos, ha cambiado ideas preconcebidas: los pandas gigantes no son silenciosos. Todo lo contrario. Producen sonidos durante la temporada de reproduccin para coordinarse y expresar sus preferencias. Los resultados del trabajo muestran el potencial de las vocalizaciones de las cuales depende su xito de apareamiento.De la tierra al marEl agua es un medio eficaz para transmitir sonido e informaciones a largas distancias. Los peces tambin hacen lo que se nombra llamadas de apareamiento como se registr en tres especies llamadas Prochilodus argenteus, P. costatus y P. lineatus, segn se public hace tres aos. Por otra parte, una decena de crustceos son capaces de emitir sonidos. Los cangrejos son un ejemplo curioso. Todava muy misteriosos en cuanto a su estructura y su anatoma, estos animales tambin recurren a sonidos bajo el agua a la hora de reproducirse, tanto el macho como la hembra. Frente a todo esto, para Francesco Filiciotto, autor de un estudio sobre la especie Neohelice granulata e investigador del Consejo Nacional de Investigacin de Italia, el foco ms importante es el impacto que tiene el ser humano sobre estas comunicaciones vitales.Es el gran problema. El nivel de ruido en el agua ha aumentado unos 50 decibelios en los ltimos 30 aos, explica Filiciotto. Sin embargo, los mensajes de los cangrejos, que recorren unos 200 metros, por ejemplo, no suelen superar los seis decibelios. En definitiva, el ser humano contribuye a reducir la comunicacin que les permite alimentarse, protegerse y reproducirse. La contaminacin acstica hace que el agua se convierta en un desierto, concluye el cientfico. Otra de las especies que ms le intrigan son los moluscos que producen sonidos, pero el cmo lo hacen es un misterio todava.Estos son tan solo algunos ejemplos de animales que utilizan los sonidos como mtodo de seduccin para asegurarse una descendencia de la mejor calidad posible. La lista es larga.Puedes seguir a MATERIA en Facebook, Twitter, Instagram o suscribirte aqu a nuestra Newsletter.",Lecciones sonoras de los animales para seducir,https://elpais.com/ciencia/2020-08-03/lecciones-sonoras-de-los-animales-para-seducir.html

"El comisario Jos Villarejo, a su llegada a los juzgados de la plaza de Castilla en junio de 2017.EL PASEn agosto de 2019, el comisario jubilado Jos Manuel Villarejo, encarcelado desde noviembre de 2017 como presunto cabecilla de una mafia policial, envi un comunicado de prensa. No era el primero. Casi desde su ingreso en prisin haba remitido textos en los que defenda su inocencia y cargaba contra los que consideraba responsables de su situacin judicial. Sin embargo, en aquel comunicado haba una novedad: lanzaba veladas amenazas a la monarqua. Est valiendo la pena el dao gravsimo que se est infringiendo a la Corona, erosionando irreversiblemente la figura de un monarca a quien tanto debemos los espaoles?, deca para despus hablar de la entonces casi desconocida investigacin de la fiscala de Suiza sobre las cuentas de Juan Carlos I.El caso Carol as bautiz el polica el informe que hizo sobre sus contactos en junio de 2015 en Londres con la amiga del rey emrito es, en realidad, un tentculo del caso Villarejo. Aunque no uno ms. Es al que el polica se ha agarrado reiteradamente para conseguir impunidad. Sin xito. Arranca de aquel encuentro en la capital britnica con la amiga del rey emrito al que acude para conseguir informacin contra el general Flix Sanz Roldn, entonces director del CNI y convertido en su bestia negra desde que en octubre del ao anterior se hubiera destapado el caso del Pequeo Nicols, en la que el comisario estaba implicado.Como tena costumbre, Villarejo grab la conversacin en la que Corinna Larsen dio detalles sobre supuestas actividades ilcitas de Juan Carlos I. En aquella conversacin, el comisario afirm: No quiero hacer dao a la Corona de mi pas, pero lo que est claro es que hay que poner un poco de orden con tanta estupidez. El polica guard aquel audio en el archivo 150416_16R. Su difusin, en el verano de 2018, fue el detonante del escndalo que llev el lunes al rey emrito a abandonar Espaa.Villarejo consider aquella grabacin algo parecido a un salvoconducto, segn se desprende de algunos audios que se le intervinieron. As, en febrero de 2017 nueve meses antes de su arresto Villarejo ya intua que era investigado y se mostraba convencido de que en cualquier momento un juez iba a ordenar el registro de su vivienda. En la conversacin con un periodista que el polica grab se muestra desafiante: Le dir al secretario [judicial]: tome nota, que se llevan esto, una declaracin jurada de una seora que se llama Corinna no s qu dice esto, aqu est. En ese mismo audio el comisario se jactaba de copias: No se preocupe porque la rompa porque tengo muchas copias (...) Pero tonto, si tengo siete copias obviamente! Tengo siete copias y tres de ellas, en el extranjero.Tres meses despus, an en libertad, Villarejo amag por primera vez con utilizar su contenido ante la justicia. Fue en la denuncia que present en mayo de 2017 en la Audiencia Nacional contra Sanz Roldn. En aquella denuncia que finalmente no fue admitida a trmite Villarejo acusaba al militar de haber fabricado pruebas falsas para implicarle, entre otros, en el caso del Pequeo Nicols. Aseguraba tener 23 dosieres sobre otras tantas actuaciones presuntamente irregulares del CNI. Entre esos dosieres, uno llamado Amenazas de muerte a C., persona muy prxima a alta personalidad del E., en clara referencia a su conversacin con Corinna.La detencin en noviembre de 2017 de Villarejo permiti a la Polica localizar en un disco duro intervenido a su socio, el abogado Rafael Redondo, una carpeta con diferentes archivos referidos a Corinna Larsen, entre ellos el audio grabado por el comisario durante su encuentro en Londres con la amiga del rey. Esta grabacin fue divulgada parcialmente el 11 de julio de 2018 por OKdiario y El Espaol, en lo que se interpret entonces como una supuesta estrategia de presin del comisario jubilado para ser excarcelado. Dos das despus, Villarejo remita al entonces juez instructor, Diego de Egea, un escrito en el que se desmarcaba de la difusin del audio, pero tambin deslizaba que parte de la documentacin que le haban intervenido podra afectar a altas instituciones del Estado.Poco ms tarde, y tras recibir un informe de la Polica sobre el audio, el juez De Egea abri en el caso Villarejo, una pieza separada para investigar la grabacin, aunque termin archivndola de manera provisional en septiembre de 2018. As estuvo hasta que el pasado 27 de julio, el ahora instructor de la causa, el juez Manuel Garca Castelln, ordenada reabrirla. En su auto, el magistrado destacaba que la Polica le haba enviado un oficio el 31 de enero con dos nuevos audios del comisario. El juez sealaba que la nueva investigacin tena como objetivo esclarecer la posible existencia de un encargo de Larsen a Villarejo para que el comisario obtuviera datos sobre la asistente espaola de ella, de la que sospechaba que estaba facilitando y filtrando informacin a terceros.Villarejo y Larsen tendrn que declarar como imputados por ello los prximos 7 y 8 de septiembre. La estrategia del comisario es ahora diferente. En su ltimo comunicado, de la pasada semana tras reabrise la pieza Carol, tildaba de calvario la situacin del rey emrito y amenazaba con destapar un centenar de nuevos escndalos, sin concretar.",Cuando Villarejo deca no querer daar a la corona,https://elpais.com/espana/2020-08-04/cuando-villarejo-decia-no-querer-danar-a-la-corona.html

"La Corte Suprema de Colombia orden este martes la detencin preventiva del expresidente lvaro Uribe por un delito de soborno y manipulacin de testigos en uno de los casos que afectan al poltico, que gobern el pas andino entre 2002 y 2010. El tribunal, que concedi al exmandatario arresto domiciliario, investiga un expediente segn el cual varios testigos recibieron compensaciones a cambio de ofrecer testimonios que favorecen al actual senador. Entre esas declaraciones figura la de un antiguo paramilitar que en una primera fase del juicio haba involucrado a Uribe en el nacimiento de un bloque de las autodefensas colombianas.Se trata de una decisin sin precedentes en Colombia. Uribe, fundador del actual partido de Gobierno, el Centro Democrtico, y mentor poltico del presidente Ivn Duque, ocupa actualmente un escao en el Congreso tras convertirse en 2018 en el senador ms votado en la historia del pas. Su caso se remonta a 2012, cuando present una denuncia contra el senador progresista Ivn Cepeda ante la Corte Suprema por un supuesto complot, con falsos testigos en crceles colombianas, a fin de involucrarlo en actividades de grupos paramilitares. El alto tribunal, sin embargo, se abstuvo de procesar a Cepeda y por el contrario pidi investigar a Uribe bajo la sospecha de haber manipulado testigos contra el congresista del Polo Democrtico.El propio Uribe confirm la decisin de la Corte, que en trminos jurdicos segn la legislacin colombiana es una medida de aseguramiento, a travs de sus redes sociales. La privacin de mi libertad me causa profunda tristeza por mi seora, mi familia y por los colombianos que todava creen que algo bueno he hecho por la patria, escribi en su cuenta de Twitter. El senador Uribe Velez cumplira la privacion de la libertad en su residencia y desde alli podra continuar ejerciendo su defensa con todas las garantias del derecho al debido proceso, seal horas despus la Corte en un comunicado. La decisin, que el tribunal justific ante posibles riesgos de obstruccion de la justicia, fue aprobada por unanimidad.La investigacin se centra en esta fase en determinar si personas vinculadas con l, como sus abogados, y con su consentimiento, pagaron dinero y ofrecieron beneficios judiciales a exparamilitares para que se retractaran. La denuncia original de un paramilitar seala que en una antigua propiedad de la familia Uribe se cre un grupo de autodefensas. Se trataba de Los 12 Apstoles, que entre amenazas a la poblacin, connivencia con las fuerzas de seguridad, retenciones y una estrecha relacin con Santiago Uribe, hermano del expresidente, operaban segn un grupo de testigos en una finca familiar.La privacin de mi libertad me causa profunda tristeza por mi seora, por mi familia y por los colombianos que todava creen que algo bueno he hecho por la Patria� lvaro Uribe Vlez (@AlvaroUribeVel) August 4, 2020

La decisin de la Corte vena precedida desde la vspera por una fuerte controversia que implic pronunciamientos de funcionarios del alto Gobierno, del Centro Democrtico, las instancias judiciales y del propio presidente Duque. Ser siempre un creyente de la inocencia de lvaro Uribe, declar el mandatario. En la tarde del martes, reiter en una declaracin desde la Casa de Nario, la sede de Gobierno, su defensa de la inocencia y honorabilidad de quien con su ejemplo se ha ganado un lugar en la historia de Colombia.Los sectores de oposicin consideraron los mltiples pronunciamientos como presiones a la justicia. El senador Cepeda haba pedido al Centro Democrtico cesar en sus intentos por intimidar y presionar a los magistrados de la Corte, y a Duque comportarse como un jefe de Estado y no como defensor de oficio de su mentor poltico. Cerca de la medianoche del lunes, todas las altas cortes publicaron un inusual comunicado conjunto para hacer un llamado al respeto de la rama judicial y su independencia. Las providencias judiciales tienen instancias legales para ser controvertidas. De ah que sean inaceptables descalificaciones a decisiones judiciales por adoptar y sin que an se conozca su contenido, sentido o alcance, declararon.Soy y ser siempre un creyente en la inocencia y honorabilidad de quien con su ejemplo se ha ganado un lugar en la historia de Colombia. pic.twitter.com/C32N0blWY6� Ivn Duque  (@IvanDuque) August 4, 2020

Uribe es probablemente el poltico que ms divide a la sociedad colombiana. Amado y odiado, frreo detractor de los acuerdos de paz con las FARC alcanzados en 2016 por su sucesor, Juan Manuel Santos, en torno a l se constituy toda una corriente poltica, el uribismo, que en la prctica encarna posiciones de derecha radical. Durante sus dos mandatos impuls una poltica de seguridad aplaudida por los sectores ms conservadores por su mano dura, pero al mismo tiempo sealada como caldo de cultivo de los llamados falsos positivos, cientos de ejecuciones extrajudiciales de civiles presentados despus por los militares como guerrilleros cados en combates a cambio de beneficios. Segn un informe de la Fiscala publicado el ao pasado hubo al menos 2.248 ejecuciones extrajudiciales entre 1998 y 2014, aunque el 97% de los casos se dieron entre el primer y el segundo mandato de Uribe.",La Corte Suprema de Colombia ordena la detencin del expresidente lvaro Uribe ,https://elpais.com/internacional/2020-08-04/la-corte-suprema-de-colombia-ordena-la-detencion-del-expresidente-alvaro-uribe.html

